index,用户昵称,初评,初评日期,追评,追评日期,追评天数,是否有用,用户id,超级会员,产品,类别,标题,平台,商品链接
1454,t***2,眼霜，用着很舒服，挺水润的💦💦按摩一下，吸收的很好，用过后眼周很放松✨✨淡化黑眼圈效果不错，挺好的，很喜欢💯💯💯,2021-03-24 09:47:04,好用，性价比高，会坚持使用的~,2021-03-24 09:50:37,0,True,1125353032209,False,眼霜,化妆品净含量:魅影紫管,ahc眼霜抗皱细纹去淡化黑眼圈补水保湿学生女第八代8七男眼袋去除,tmall,https://detail.tmall.com/item.htm?id=567637757708&ns=1&abbucket=6
1455,蠢***冰,东西收到了，比想象中的好太多了,2021-04-23 18:43:57,Null,Null,Null,True,1130194418492,False,眼霜,化妆品净含量:宝石蓝管,ahc眼霜抗皱细纹去淡化黑眼圈补水保湿学生女第八代8七男眼袋去除,tmall,https://detail.tmall.com/item.htm?id=567637757708&ns=1&abbucket=6
1456,天***2,以前买过的用着还可以，快递挺快的挺好的。,2021-04-24 12:30:23,Null,Null,Null,True,1130267070292,False,眼霜,化妆品净含量:魅影紫管,ahc眼霜抗皱细纹去淡化黑眼圈补水保湿学生女第八代8七男眼袋去除,tmall,https://detail.tmall.com/item.htm?id=567637757708&ns=1&abbucket=6
1457,温***蓄,客服态度很好，产品介绍很详细,2021-04-09 17:47:52,Null,Null,Null,True,1127976513639,False,眼霜,化妆品净含量:宝石蓝管,ahc眼霜抗皱细纹去淡化黑眼圈补水保湿学生女第八代8七男眼袋去除,tmall,https://detail.tmall.com/item.htm?id=567637757708&ns=1&abbucket=6
1458,凝***情,此用户没有填写评论!,2021-01-18 13:40:29,妈妈很喜欢用,2021-04-06 15:36:28,93,True,1127141992588,False,眼霜,化妆品净含量:宝石蓝管,ahc眼霜抗皱细纹去淡化黑眼圈补水保湿学生女第八代8七男眼袋去除,tmall,https://detail.tmall.com/item.htm?id=567637757708&ns=1&abbucket=6
1459,m***2,看起来不错,2021-04-02 23:15:11,Null,Null,Null,True,1126691380622,False,眼霜,化妆品净含量:宝石蓝管,ahc眼霜抗皱细纹去淡化黑眼圈补水保湿学生女第八代8七男眼袋去除,tmall,https://detail.tmall.com/item.htm?id=567637757708&ns=1&abbucket=6
1460,姓***娇,眼霜很好用,2021-04-06 15:27:53,Null,Null,Null,True,1127574061952,False,眼霜,化妆品净含量:魅影紫管,ahc眼霜抗皱细纹去淡化黑眼圈补水保湿学生女第八代8七男眼袋去除,tmall,https://detail.tmall.com/item.htm?id=567637757708&ns=1&abbucket=6
1461,t***8,商品气味：好闻,2021-03-31 00:50:58,Null,Null,Null,True,1127164298017,False,眼霜,化妆品净含量:炫黑黑管,ahc眼霜抗皱细纹去淡化黑眼圈补水保湿学生女第八代8七男眼袋去除,tmall,https://detail.tmall.com/item.htm?id=567637757708&ns=1&abbucket=6
1462,t***0,很好 第二次购买了,2021-04-08 16:18:17,Null,Null,Null,True,1128667643116,False,眼霜,化妆品净含量:炫黑黑管,ahc眼霜抗皱细纹去淡化黑眼圈补水保湿学生女第八代8七男眼袋去除,tmall,https://detail.tmall.com/item.htm?id=567637757708&ns=1&abbucket=6
1463,f***l,用了一次，感觉不错,2021-05-01 16:15:42,Null,Null,Null,True,1131157098333,False,眼霜,化妆品净含量:宝石蓝管,ahc眼霜抗皱细纹去淡化黑眼圈补水保湿学生女第八代8七男眼袋去除,tmall,https://detail.tmall.com/item.htm?id=567637757708&ns=1&abbucket=6
1464,t***2,很好，服务态度也很好，good,2021-04-13 18:09:11,很好用谢谢。,2021-04-13 18:10:15,0,True,1128487077385,False,眼霜,化妆品净含量:宝石蓝管,ahc眼霜抗皱细纹去淡化黑眼圈补水保湿学生女第八代8七男眼袋去除,tmall,https://detail.tmall.com/item.htm?id=567637757708&ns=1&abbucket=6
1465,艾***可,宝贝，非常好,2021-03-31 13:16:29,Null,Null,Null,True,1126351744736,False,眼霜,化妆品净含量:炫黑黑管,ahc眼霜抗皱细纹去淡化黑眼圈补水保湿学生女第八代8七男眼袋去除,tmall,https://detail.tmall.com/item.htm?id=567637757708&ns=1&abbucket=6
1466,t***3,非常好的一款眼霜，不错,2021-04-10 18:30:52,Null,Null,Null,True,1127671936492,False,眼霜,化妆品净含量:炫黑黑管,ahc眼霜抗皱细纹去淡化黑眼圈补水保湿学生女第八代8七男眼袋去除,tmall,https://detail.tmall.com/item.htm?id=567637757708&ns=1&abbucket=6
1467,只***9,非常好，非常满意.嘎嘎好,2021-04-06 12:37:22,Null,Null,Null,True,1128381055053,False,眼霜,化妆品净含量:魅影紫管,ahc眼霜抗皱细纹去淡化黑眼圈补水保湿学生女第八代8七男眼袋去除,tmall,https://detail.tmall.com/item.htm?id=567637757708&ns=1&abbucket=6
1468,t***8,朋友介绍的可以,2021-03-28 15:55:47,Null,Null,Null,True,1127230431158,False,眼霜,化妆品净含量:宝石蓝管,ahc眼霜抗皱细纹去淡化黑眼圈补水保湿学生女第八代8七男眼袋去除,tmall,https://detail.tmall.com/item.htm?id=567637757708&ns=1&abbucket=6
1469,t***4,物流很快，眼霜外观很好看，还没开始用,2021-03-28 09:06:40,Null,Null,Null,True,1125921312850,False,眼霜,化妆品净含量:炫黑黑管,ahc眼霜抗皱细纹去淡化黑眼圈补水保湿学生女第八代8七男眼袋去除,tmall,https://detail.tmall.com/item.htm?id=567637757708&ns=1&abbucket=6
1470,a***2,东西不错,2021-03-29 10:35:15,Null,Null,Null,True,1126058164985,False,眼霜,化妆品净含量:宝石蓝管,ahc眼霜抗皱细纹去淡化黑眼圈补水保湿学生女第八代8七男眼袋去除,tmall,https://detail.tmall.com/item.htm?id=567637757708&ns=1&abbucket=6
1471,双***脏,给老妈买的，😂,2021-05-01 23:36:46,Null,Null,Null,True,1130308864029,True,眼霜,化妆品净含量:宝石蓝管,ahc眼霜抗皱细纹去淡化黑眼圈补水保湿学生女第八代8七男眼袋去除,tmall,https://detail.tmall.com/item.htm?id=567637757708&ns=1&abbucket=6
1472,斗***飞,推荐大家购买,2021-04-05 22:45:06,Null,Null,Null,True,1127061624634,True,眼霜,化妆品净含量:炫黑黑管,ahc眼霜抗皱细纹去淡化黑眼圈补水保湿学生女第八代8七男眼袋去除,tmall,https://detail.tmall.com/item.htm?id=567637757708&ns=1&abbucket=6
1473,s***s,很不错，第一次用眼霜,2021-04-02 14:41:57,Null,Null,Null,True,1127885139606,False,眼霜,化妆品净含量:魅影紫管,ahc眼霜抗皱细纹去淡化黑眼圈补水保湿学生女第八代8七男眼袋去除,tmall,https://detail.tmall.com/item.htm?id=567637757708&ns=1&abbucket=6
1474,t***1,包装品质：包装的很好 商品气味：气味好闻 使用效果：效果不错容易推开不油腻,2021-03-09 19:13:30,Null,Null,Null,True,1123638648213,False,眼霜,化妆品净含量:炫黑黑管,ahc眼霜抗皱细纹去淡化黑眼圈补水保湿学生女第八代8七男眼袋去除,tmall,https://detail.tmall.com/item.htm?id=567637757708&ns=1&abbucket=6
1475,咖***瘦,第N次回购了😁,2021-04-05 11:43:17,Null,Null,Null,True,1126974632872,False,眼霜,化妆品净含量:宝石蓝管,ahc眼霜抗皱细纹去淡化黑眼圈补水保湿学生女第八代8七男眼袋去除,tmall,https://detail.tmall.com/item.htm?id=567637757708&ns=1&abbucket=6
1476,南***o,买了两次，挺好用的,2021-04-14 09:50:39,Null,Null,Null,True,1128107964344,False,眼霜,化妆品净含量:炫黑黑管,ahc眼霜抗皱细纹去淡化黑眼圈补水保湿学生女第八代8七男眼袋去除,tmall,https://detail.tmall.com/item.htm?id=567637757708&ns=1&abbucket=6
1477,t***4,非常好用，很水润,2021-04-07 19:14:44,Null,Null,Null,True,1127734109697,False,眼霜,化妆品净含量:炫黑黑管,ahc眼霜抗皱细纹去淡化黑眼圈补水保湿学生女第八代8七男眼袋去除,tmall,https://detail.tmall.com/item.htm?id=567637757708&ns=1&abbucket=6
1478,t***4,还可以，用着挺好的,2021-04-27 20:45:07,Null,Null,Null,True,1129825976852,False,眼霜,化妆品净含量:魅影紫管,ahc眼霜抗皱细纹去淡化黑眼圈补水保湿学生女第八代8七男眼袋去除,tmall,https://detail.tmall.com/item.htm?id=567637757708&ns=1&abbucket=6
1479,美***4,入手的这个眼霜质地还是很轻盈的，涂在眼睛周围也是很好吸收的，没有什么厚重油腻感觉我还是很喜欢的，味道是淡淡的清香可以用指腹按摩吸收🌵,2021-03-22 13:33:21,补水保湿的效果还是很好的,2021-03-22 13:37:41,2,True,1125116908588,False,眼霜,化妆品净含量:炫黑黑管,ahc眼霜抗皱细纹去淡化黑眼圈补水保湿学生女第八代8七男眼袋去除,tmall,https://detail.tmall.com/item.htm?id=567637757708&ns=1&abbucket=6
1480,筝***z,很棒，无限回购～,2021-04-11 21:01:57,Null,Null,Null,True,1129082243164,True,眼霜,化妆品净含量:炫黑黑管,ahc眼霜抗皱细纹去淡化黑眼圈补水保湿学生女第八代8七男眼袋去除,tmall,https://detail.tmall.com/item.htm?id=567637757708&ns=1&abbucket=6
1481,我***呀,好用，以后就在这买了,2021-03-29 20:46:44,Null,Null,Null,True,1126574761888,False,眼霜,化妆品净含量:宝石蓝管,ahc眼霜抗皱细纹去淡化黑眼圈补水保湿学生女第八代8七男眼袋去除,tmall,https://detail.tmall.com/item.htm?id=567637757708&ns=1&abbucket=6
1482,a***6,用了几天感觉还挺好的,2021-04-14 17:59:36,Null,Null,Null,True,1129447919657,False,眼霜,化妆品净含量:宝石蓝管,ahc眼霜抗皱细纹去淡化黑眼圈补水保湿学生女第八代8七男眼袋去除,tmall,https://detail.tmall.com/item.htm?id=567637757708&ns=1&abbucket=6
1483,t***1,宝贝收到了，好用的牌子。,2021-03-30 15:05:30,Null,Null,Null,True,1126663757078,False,眼霜,化妆品净含量:魅影紫管,ahc眼霜抗皱细纹去淡化黑眼圈补水保湿学生女第八代8七男眼袋去除,tmall,https://detail.tmall.com/item.htm?id=567637757708&ns=1&abbucket=6
1484,酥***4,此用户没有填写评论!,2020-12-27 05:13:13,对我来说，很刺激，味道太香。最近出现眼皮痒，只能拿来涂脖子了。平常用莎娜，明亮，即使弄到眼睛也觉得很温和的。结论：不会回购,2021-03-25 16:38:06,103,True,1126429766709,False,眼霜,化妆品净含量:炫黑黑管,ahc眼霜抗皱细纹去淡化黑眼圈补水保湿学生女第八代8七男眼袋去除,tmall,https://detail.tmall.com/item.htm?id=567637757708&ns=1&abbucket=6
1485,李***杨,Ahc的眼霜真的非常好   一直在用  性价比很高   以前用的紫色的   这次入手了 黑色  效果也是非常不错的  值得购买,2021-03-22 17:38:01,Null,Null,Null,True,1125587029649,False,眼霜,化妆品净含量:炫黑黑管,ahc眼霜抗皱细纹去淡化黑眼圈补水保湿学生女第八代8七男眼袋去除,tmall,https://detail.tmall.com/item.htm?id=567637757708&ns=1&abbucket=6
1486,徐***y,还没用，用后追加。,2021-04-24 20:32:11,Null,Null,Null,True,1129886337522,False,眼霜,化妆品净含量:魅影紫管,ahc眼霜抗皱细纹去淡化黑眼圈补水保湿学生女第八代8七男眼袋去除,tmall,https://detail.tmall.com/item.htm?id=567637757708&ns=1&abbucket=6
1487,l***2,还没用会追评,2021-04-08 00:00:40,Null,Null,Null,True,1128192526707,True,眼霜,化妆品净含量:炫黑黑管,ahc眼霜抗皱细纹去淡化黑眼圈补水保湿学生女第八代8七男眼袋去除,tmall,https://detail.tmall.com/item.htm?id=567637757708&ns=1&abbucket=6
1488,t***6,包装品质：很大气上档次， 商品气味：淡淡的香味。 使用效果：一直在用这个眼霜，很保湿不油腻，效果也挺好，发货速度也很快，谢谢店家。,2021-03-22 09:18:53,Null,Null,Null,True,1125508857979,False,眼霜,化妆品净含量:炫黑黑管,ahc眼霜抗皱细纹去淡化黑眼圈补水保湿学生女第八代8七男眼袋去除,tmall,https://detail.tmall.com/item.htm?id=567637757708&ns=1&abbucket=6
1489,t***7,宝贝收到了，物流很快，包装精致，价格也不算很贵，已经用了一个星期，效果暂时看不出来，但感觉很不错，总之先评论了，后续情况再说吧！,2021-03-18 21:11:28,Null,Null,Null,True,1125900951870,False,眼霜,化妆品净含量:宝石蓝管,ahc眼霜抗皱细纹去淡化黑眼圈补水保湿学生女第八代8七男眼袋去除,tmall,https://detail.tmall.com/item.htm?id=567637757708&ns=1&abbucket=6
1490,p***5,很不错的外观。,2021-03-28 14:16:18,Null,Null,Null,True,1125962000936,False,眼霜,化妆品净含量:炫黑黑管,ahc眼霜抗皱细纹去淡化黑眼圈补水保湿学生女第八代8七男眼袋去除,tmall,https://detail.tmall.com/item.htm?id=567637757708&ns=1&abbucket=6
1491,q***g,质量上佳。,2021-04-30 20:19:09,Null,Null,Null,True,1131473187271,True,眼霜,化妆品净含量:炫黑黑管,ahc眼霜抗皱细纹去淡化黑眼圈补水保湿学生女第八代8七男眼袋去除,tmall,https://detail.tmall.com/item.htm?id=567637757708&ns=1&abbucket=6
1492,l***6,正在用，希望效果好。,2021-04-10 15:25:44,Null,Null,Null,True,1128080757340,False,眼霜,化妆品净含量:宝石蓝管,ahc眼霜抗皱细纹去淡化黑眼圈补水保湿学生女第八代8七男眼袋去除,tmall,https://detail.tmall.com/item.htm?id=567637757708&ns=1&abbucket=6
1493,t***3,很好用，会回购,2021-03-28 14:15:37,Null,Null,Null,True,1126393301314,False,眼霜,化妆品净含量:魅影紫管,ahc眼霜抗皱细纹去淡化黑眼圈补水保湿学生女第八代8七男眼袋去除,tmall,https://detail.tmall.com/item.htm?id=567637757708&ns=1&abbucket=6
1494,不***华,回购的，非常不错,2021-04-01 17:37:13,Null,Null,Null,True,1127385194974,False,眼霜,化妆品净含量:魅影紫管,ahc眼霜抗皱细纹去淡化黑眼圈补水保湿学生女第八代8七男眼袋去除,tmall,https://detail.tmall.com/item.htm?id=567637757708&ns=1&abbucket=6
1495,玛***0,没用呢 应该挺好用吧,2021-04-11 00:01:42,Null,Null,Null,True,1128137217126,False,眼霜,化妆品净含量:炫黑黑管,ahc眼霜抗皱细纹去淡化黑眼圈补水保湿学生女第八代8七男眼袋去除,tmall,https://detail.tmall.com/item.htm?id=567637757708&ns=1&abbucket=6
1496,a***5,还在用用了还是有效果的,2021-03-28 18:46:37,Null,Null,Null,True,1126861930685,False,眼霜,化妆品净含量:魅影紫管,ahc眼霜抗皱细纹去淡化黑眼圈补水保湿学生女第八代8七男眼袋去除,tmall,https://detail.tmall.com/item.htm?id=567637757708&ns=1&abbucket=6
1497,t***7,这个发货速度真的是棒,2021-04-10 10:01:11,Null,Null,Null,True,1128867459830,False,眼霜,化妆品净含量:炫黑黑管,ahc眼霜抗皱细纹去淡化黑眼圈补水保湿学生女第八代8七男眼袋去除,tmall,https://detail.tmall.com/item.htm?id=567637757708&ns=1&abbucket=6
1498,马***r,东西很不错，一直在用，是正品，下次还回来买,2021-03-21 22:05:49,是真心评价，确实好用，对得起这个价格。不油腻。可以试试没有什么过敏。,2021-03-22 09:58:37,0,True,1125054004028,False,眼霜,化妆品净含量:魅影紫管,ahc眼霜抗皱细纹去淡化黑眼圈补水保湿学生女第八代8七男眼袋去除,tmall,https://detail.tmall.com/item.htm?id=567637757708&ns=1&abbucket=6
1499,我***a,眼霜很大一支，应该可以用很久。性价比很高。质地也很好吸收。种草,2021-03-04 22:10:33,Null,Null,Null,True,1123232384366,False,眼霜,化妆品净含量:炫黑黑管,ahc眼霜抗皱细纹去淡化黑眼圈补水保湿学生女第八代8七男眼袋去除,tmall,https://detail.tmall.com/item.htm?id=567637757708&ns=1&abbucket=6
1500,柚***l,好用好用 推荐,2021-03-30 06:38:13,Null,Null,Null,True,1127030278239,True,眼霜,化妆品净含量:炫黑黑管,ahc眼霜抗皱细纹去淡化黑眼圈补水保湿学生女第八代8七男眼袋去除,tmall,https://detail.tmall.com/item.htm?id=567637757708&ns=1&abbucket=6
1501,嗯***￥,天呐这么好的东西竟然被我发现了！ 商品气味：味道香香的 使用效果：很水润！一点也不粘腻 对我眼睛周围干燥的皮肤简直不要太好啊啊！,2021-03-22 21:57:59,Null,Null,Null,True,1126047978471,False,眼霜,化妆品净含量:宝石蓝管,ahc眼霜抗皱细纹去淡化黑眼圈补水保湿学生女第八代8七男眼袋去除,tmall,https://detail.tmall.com/item.htm?id=567637757708&ns=1&abbucket=6
1502,l***4,不错还可以,2021-04-06 15:39:12,Null,Null,Null,True,1127142360274,False,眼霜,化妆品净含量:宝石蓝管,ahc眼霜抗皱细纹去淡化黑眼圈补水保湿学生女第八代8七男眼袋去除,tmall,https://detail.tmall.com/item.htm?id=567637757708&ns=1&abbucket=6
1503,孤***8,好用，一直都在用,2021-04-08 09:35:21,Null,Null,Null,True,1127780365337,False,眼霜,化妆品净含量:魅影紫管,ahc眼霜抗皱细纹去淡化黑眼圈补水保湿学生女第八代8七男眼袋去除,tmall,https://detail.tmall.com/item.htm?id=567637757708&ns=1&abbucket=6
1504,a***2,看图片很不错,2021-04-12 12:23:20,Null,Null,Null,True,1128305813927,True,眼霜,化妆品净含量:炫黑黑管,ahc眼霜抗皱细纹去淡化黑眼圈补水保湿学生女第八代8七男眼袋去除,tmall,https://detail.tmall.com/item.htm?id=567637757708&ns=1&abbucket=6
1505,翔***贝,一直在用，很好用,2021-04-09 07:43:42,Null,Null,Null,True,1128325882191,False,眼霜,化妆品净含量:炫黑黑管,ahc眼霜抗皱细纹去淡化黑眼圈补水保湿学生女第八代8七男眼袋去除,tmall,https://detail.tmall.com/item.htm?id=567637757708&ns=1&abbucket=6
1506,z***9,眼霜收到了，晚上就迫不及待的打开用了，跟预想的一样，味道清新不腻，质地细腻容易推开，易吸收，保湿效果不错！,2021-03-14 10:33:30,Null,Null,Null,True,1124970234376,False,眼霜,化妆品净含量:炫黑黑管,ahc眼霜抗皱细纹去淡化黑眼圈补水保湿学生女第八代8七男眼袋去除,tmall,https://detail.tmall.com/item.htm?id=567637757708&ns=1&abbucket=6
1507,c***j,很好用，买了几年了,2021-04-03 23:00:01,Null,Null,Null,True,1126816316153,True,眼霜,化妆品净含量:炫黑黑管,ahc眼霜抗皱细纹去淡化黑眼圈补水保湿学生女第八代8七男眼袋去除,tmall,https://detail.tmall.com/item.htm?id=567637757708&ns=1&abbucket=6
1508,t***8,此用户没有填写评论!,2021-04-18 15:04:12,还行吧，不怎么用,2021-05-01 15:13:15,28,True,1130699773169,False,眼霜,化妆品净含量:魅影紫管,ahc眼霜抗皱细纹去淡化黑眼圈补水保湿学生女第八代8七男眼袋去除,tmall,https://detail.tmall.com/item.htm?id=567637757708&ns=1&abbucket=6
1509,h***4,一如既往的好。很喜欢，满分。,2021-04-01 19:32:21,Null,Null,Null,True,1127797507550,False,眼霜,化妆品净含量:魅影紫管,ahc眼霜抗皱细纹去淡化黑眼圈补水保湿学生女第八代8七男眼袋去除,tmall,https://detail.tmall.com/item.htm?id=567637757708&ns=1&abbucket=6
1510,o***1,包装品质：高级 商品气味：挺香的 使用效果：已经是老顾客了 保湿效果还不错 这款还没有试过 之后再追加,2021-03-25 16:19:07,Null,Null,Null,True,1126811463481,False,眼霜,化妆品净含量:炫黑黑管,ahc眼霜抗皱细纹去淡化黑眼圈补水保湿学生女第八代8七男眼袋去除,tmall,https://detail.tmall.com/item.htm?id=567637757708&ns=1&abbucket=6
1511,谦***8,有淡淡香味，可以，不错,2021-04-14 21:10:20,Null,Null,Null,True,1129468607679,False,眼霜,化妆品净含量:炫黑黑管,ahc眼霜抗皱细纹去淡化黑眼圈补水保湿学生女第八代8七男眼袋去除,tmall,https://detail.tmall.com/item.htm?id=567637757708&ns=1&abbucket=6
1512,t***3,发货速度好快，挺正品的，好评！,2021-04-11 12:38:19,Null,Null,Null,True,1127746516767,False,眼霜,化妆品净含量:宝石蓝管,ahc眼霜抗皱细纹去淡化黑眼圈补水保湿学生女第八代8七男眼袋去除,tmall,https://detail.tmall.com/item.htm?id=567637757708&ns=1&abbucket=6
1513,w***6,物流特别快  包装品质：很有质感 使用效果：保湿 易吸收 商品气味：淡香,2021-02-25 18:21:33,Null,Null,Null,True,1122689580723,False,眼霜,化妆品净含量:宝石蓝管,ahc眼霜抗皱细纹去淡化黑眼圈补水保湿学生女第八代8七男眼袋去除,tmall,https://detail.tmall.com/item.htm?id=567637757708&ns=1&abbucket=6
1514,捂***薇,润润的很好用,2021-04-14 09:13:12,Null,Null,Null,True,1128102648787,False,眼霜,化妆品净含量:魅影紫管,ahc眼霜抗皱细纹去淡化黑眼圈补水保湿学生女第八代8七男眼袋去除,tmall,https://detail.tmall.com/item.htm?id=567637757708&ns=1&abbucket=6
1515,t***9,很好 很喜欢,2021-04-07 18:52:52,Null,Null,Null,True,1128563103179,False,眼霜,化妆品净含量:魅影紫管,ahc眼霜抗皱细纹去淡化黑眼圈补水保湿学生女第八代8七男眼袋去除,tmall,https://detail.tmall.com/item.htm?id=567637757708&ns=1&abbucket=6
1516,t***3,超快，好棒,2021-04-07 12:31:46,Null,Null,Null,True,1127243332603,False,眼霜,化妆品净含量:炫黑黑管,ahc眼霜抗皱细纹去淡化黑眼圈补水保湿学生女第八代8七男眼袋去除,tmall,https://detail.tmall.com/item.htm?id=567637757708&ns=1&abbucket=6
1517,t***1,很好非常好,2021-03-28 12:11:47,Null,Null,Null,True,1125945732185,False,眼霜,化妆品净含量:宝石蓝管,ahc眼霜抗皱细纹去淡化黑眼圈补水保湿学生女第八代8七男眼袋去除,tmall,https://detail.tmall.com/item.htm?id=567637757708&ns=1&abbucket=6
1518,t***8,宝贝与描述相符，服务态度很好，发货速度快,2021-03-30 14:49:33,Null,Null,Null,True,1127093474004,False,眼霜,化妆品净含量:炫黑黑管,ahc眼霜抗皱细纹去淡化黑眼圈补水保湿学生女第八代8七男眼袋去除,tmall,https://detail.tmall.com/item.htm?id=567637757708&ns=1&abbucket=6
1519,晨***爱,回购了 很棒,2021-04-10 15:43:57,Null,Null,Null,True,1127648644088,False,眼霜,化妆品净含量:魅影紫管,ahc眼霜抗皱细纹去淡化黑眼圈补水保湿学生女第八代8七男眼袋去除,tmall,https://detail.tmall.com/item.htm?id=567637757708&ns=1&abbucket=6
1520,梧***伤,物流快，客服态度好，产品值得推荐赞赞赞👍,2021-04-09 17:03:51,Null,Null,Null,True,1127533376808,False,眼霜,化妆品净含量:宝石蓝管,ahc眼霜抗皱细纹去淡化黑眼圈补水保湿学生女第八代8七男眼袋去除,tmall,https://detail.tmall.com/item.htm?id=567637757708&ns=1&abbucket=6
1521,l***5,包装品质：完好无损 商品气味：无异味 使用效果：有效果 不错,2021-03-09 13:15:49,Null,Null,Null,True,1124826443009,False,眼霜,化妆品净含量:宝石蓝管,ahc眼霜抗皱细纹去淡化黑眼圈补水保湿学生女第八代8七男眼袋去除,tmall,https://detail.tmall.com/item.htm?id=567637757708&ns=1&abbucket=6
1522,t***8,差不多吧,2021-03-28 13:47:24,Null,Null,Null,True,1126389373323,False,眼霜,化妆品净含量:魅影紫管,ahc眼霜抗皱细纹去淡化黑眼圈补水保湿学生女第八代8七男眼袋去除,tmall,https://detail.tmall.com/item.htm?id=567637757708&ns=1&abbucket=6
1523,韩***2,看着挺好的,2021-04-06 11:40:51,Null,Null,Null,True,1127106700234,True,眼霜,化妆品净含量:魅影紫管,ahc眼霜抗皱细纹去淡化黑眼圈补水保湿学生女第八代8七男眼袋去除,tmall,https://detail.tmall.com/item.htm?id=567637757708&ns=1&abbucket=6
1524,t***7,非常得好,2021-04-01 18:36:55,Null,Null,Null,True,1127791251259,False,眼霜,化妆品净含量:炫黑黑管,ahc眼霜抗皱细纹去淡化黑眼圈补水保湿学生女第八代8七男眼袋去除,tmall,https://detail.tmall.com/item.htm?id=567637757708&ns=1&abbucket=6
1525,是***阿,真的很不错,2021-04-01 19:59:17,Null,Null,Null,True,1127800971079,False,眼霜,化妆品净含量:炫黑黑管,ahc眼霜抗皱细纹去淡化黑眼圈补水保湿学生女第八代8七男眼袋去除,tmall,https://detail.tmall.com/item.htm?id=567637757708&ns=1&abbucket=6
1526,我***已,已经用完两只了，不错,2021-04-11 12:49:39,Null,Null,Null,True,1128616326704,False,眼霜,化妆品净含量:魅影紫管,ahc眼霜抗皱细纹去淡化黑眼圈补水保湿学生女第八代8七男眼袋去除,tmall,https://detail.tmall.com/item.htm?id=567637757708&ns=1&abbucket=6
1527,小***纸,挺好的，刚到，用过一回,2021-04-14 20:39:59,Null,Null,Null,True,1129063302842,False,眼霜,化妆品净含量:炫黑黑管,ahc眼霜抗皱细纹去淡化黑眼圈补水保湿学生女第八代8七男眼袋去除,tmall,https://detail.tmall.com/item.htm?id=567637757708&ns=1&abbucket=6
1528,t***2,产品很好，值得购买👍👍👍👍👍,2021-03-29 22:33:02,Null,Null,Null,True,1126156848154,False,眼霜,化妆品净含量:炫黑黑管,ahc眼霜抗皱细纹去淡化黑眼圈补水保湿学生女第八代8七男眼袋去除,tmall,https://detail.tmall.com/item.htm?id=567637757708&ns=1&abbucket=6
1529,t***5,包装品质：很好，质量可以 商品气味：清香淡雅，很好 使用效果：效果不错 有想买的小伙伴可以考虑下单哦！,2021-03-04 12:21:17,Null,Null,Null,True,1124410471456,False,眼霜,化妆品净含量:炫黑黑管,ahc眼霜抗皱细纹去淡化黑眼圈补水保湿学生女第八代8七男眼袋去除,tmall,https://detail.tmall.com/item.htm?id=567637757708&ns=1&abbucket=6
1530,y***儿,性价比高，物超所值，值得购买！,2021-04-08 18:36:07,Null,Null,Null,True,1127419024643,False,眼霜,化妆品净含量:炫黑黑管,ahc眼霜抗皱细纹去淡化黑眼圈补水保湿学生女第八代8七男眼袋去除,tmall,https://detail.tmall.com/item.htm?id=567637757708&ns=1&abbucket=6
