index,用户昵称,初评,初评日期,追评,追评日期,追评天数,是否有用,用户id,超级会员,产品,类别,标题,平台,商品链接
468,斩***了,眼霜不错，物流很快，非常喜欢😉,2021-05-13 18:54:21,Null,Null,Null,True,1133129759961,False,眼霜,化妆品净含量:魅影紫管,ahc眼霜抗皱细纹去淡化黑眼圈补水保湿学生女第八代8七男眼袋去除,tmall,https://detail.tmall.com/item.htm?id=567637757708&ns=1&abbucket=6
469,h***人,超级爱 如果用了效果好 还会来追评的,2021-04-29 17:31:51,Null,Null,Null,True,1130038968253,False,眼霜,化妆品净含量:魅影紫管,ahc眼霜抗皱细纹去淡化黑眼圈补水保湿学生女第八代8七男眼袋去除,tmall,https://detail.tmall.com/item.htm?id=567637757708&ns=1&abbucket=6
470,流***可,很好吸收。水润丝滑。,2021-03-30 19:49:47,Null,Null,Null,True,1127137334626,False,眼霜,化妆品净含量:炫黑黑管,ahc眼霜抗皱细纹去淡化黑眼圈补水保湿学生女第八代8七男眼袋去除,tmall,https://detail.tmall.com/item.htm?id=567637757708&ns=1&abbucket=6
471,6***远,非常好，多次购买了，性价比高。,2021-05-02 09:10:03,Null,Null,Null,True,1130767065499,True,眼霜,化妆品净含量:炫黑黑管,ahc眼霜抗皱细纹去淡化黑眼圈补水保湿学生女第八代8七男眼袋去除,tmall,https://detail.tmall.com/item.htm?id=567637757708&ns=1&abbucket=6
472,w***5,东西看着挺好发货很快,2021-05-02 12:07:06,Null,Null,Null,True,1130789717300,False,眼霜,化妆品净含量:炫黑黑管,ahc眼霜抗皱细纹去淡化黑眼圈补水保湿学生女第八代8七男眼袋去除,tmall,https://detail.tmall.com/item.htm?id=567637757708&ns=1&abbucket=6
473,因***！,宝贝很好，清香不刺鼻，很保湿，值得回购,2021-04-27 10:44:09,Null,Null,Null,True,1129748484925,False,眼霜,化妆品净含量:魅影紫管,ahc眼霜抗皱细纹去淡化黑眼圈补水保湿学生女第八代8七男眼袋去除,tmall,https://detail.tmall.com/item.htm?id=567637757708&ns=1&abbucket=6
474,吉***3,一直都在用,2021-05-05 13:58:24,Null,Null,Null,True,1131619690217,True,眼霜,化妆品净含量:炫黑黑管,ahc眼霜抗皱细纹去淡化黑眼圈补水保湿学生女第八代8七男眼袋去除,tmall,https://detail.tmall.com/item.htm?id=567637757708&ns=1&abbucket=6
475,佰***哥,扫码扫不出来,2021-05-12 20:12:16,Null,Null,Null,True,1132149633878,False,眼霜,化妆品净含量:炫黑黑管,ahc眼霜抗皱细纹去淡化黑眼圈补水保湿学生女第八代8七男眼袋去除,tmall,https://detail.tmall.com/item.htm?id=567637757708&ns=1&abbucket=6
476,5***r,第二次购买了，不错,2021-05-07 13:53:58,Null,Null,Null,True,1131460401468,False,眼霜,化妆品净含量:宝石蓝管,ahc眼霜抗皱细纹去淡化黑眼圈补水保湿学生女第八代8七男眼袋去除,tmall,https://detail.tmall.com/item.htm?id=567637757708&ns=1&abbucket=6
477,霞***们,挺好的，第二次购买了,2021-05-07 11:31:13,Null,Null,Null,True,1131439913779,False,眼霜,化妆品净含量:宝石蓝管,ahc眼霜抗皱细纹去淡化黑眼圈补水保湿学生女第八代8七男眼袋去除,tmall,https://detail.tmall.com/item.htm?id=567637757708&ns=1&abbucket=6
478,t***1,性价比高！吸收情况：吸收快，🌃价格实惠发货很快。个人觉得还是很保湿的。外观好看，也有手感,2021-04-04 16:55:43,性价比很好，用着滋润,2021-04-04 17:00:15,0,True,1128162351545,False,眼霜,化妆品净含量:宝石蓝管,ahc眼霜抗皱细纹去淡化黑眼圈补水保湿学生女第八代8七男眼袋去除,tmall,https://detail.tmall.com/item.htm?id=567637757708&ns=1&abbucket=6
479,w***3,使用效果：一直用这个牌子，平价又好用，关键不长脂肪粒，会一直回购。,2021-04-28 09:37:23,Null,Null,Null,True,1130752162118,True,眼霜,化妆品净含量:宝石蓝管,ahc眼霜抗皱细纹去淡化黑眼圈补水保湿学生女第八代8七男眼袋去除,tmall,https://detail.tmall.com/item.htm?id=567637757708&ns=1&abbucket=6
480,半***0,用着不错，会继续回购的！,2021-04-27 12:40:21,Null,Null,Null,True,1130652882413,False,眼霜,化妆品净含量:炫黑黑管,ahc眼霜抗皱细纹去淡化黑眼圈补水保湿学生女第八代8七男眼袋去除,tmall,https://detail.tmall.com/item.htm?id=567637757708&ns=1&abbucket=6
481,t***9,超级喜欢哈哈哈哈希望有用吧！！,2021-04-28 11:51:47,Null,Null,Null,True,1130321393798,False,眼霜,化妆品净含量:魅影紫管,ahc眼霜抗皱细纹去淡化黑眼圈补水保湿学生女第八代8七男眼袋去除,tmall,https://detail.tmall.com/item.htm?id=567637757708&ns=1&abbucket=6
482,萌***2,物流很快 产品很满意 还会再回购的,2021-04-28 20:33:45,Null,Null,Null,True,1130834554831,False,眼霜,化妆品净含量:炫黑黑管,ahc眼霜抗皱细纹去淡化黑眼圈补水保湿学生女第八代8七男眼袋去除,tmall,https://detail.tmall.com/item.htm?id=567637757708&ns=1&abbucket=6
483,t***5,还不错，质地清爽，不黏腻,2021-04-27 23:15:12,Null,Null,Null,True,1131132811158,True,眼霜,化妆品净含量:炫黑黑管,ahc眼霜抗皱细纹去淡化黑眼圈补水保湿学生女第八代8七男眼袋去除,tmall,https://detail.tmall.com/item.htm?id=567637757708&ns=1&abbucket=6
484,t***2,自我感觉很好，不干，不油腻。,2021-04-30 20:12:00,Null,Null,Null,True,1130619217295,False,眼霜,化妆品净含量:炫黑黑管,ahc眼霜抗皱细纹去淡化黑眼圈补水保湿学生女第八代8七男眼袋去除,tmall,https://detail.tmall.com/item.htm?id=567637757708&ns=1&abbucket=6
485,我***9,水润的很舒服，挺好吸收的。🐠温和不刺激。抗初老眼霜，很细腻。很好吸收不担心有脂肪粒，🌊使用感很好，眼霜质地细腻，🔥很好推开很好吸收，💦没有油腻感，使用起来没有任何负担的,2021-03-16 15:03:36,香味好闻，再买一个送姐姐,2021-03-16 15:03:54,0,True,1125588231088,False,眼霜,化妆品净含量:魅影紫管,ahc眼霜抗皱细纹去淡化黑眼圈补水保湿学生女第八代8七男眼袋去除,tmall,https://detail.tmall.com/item.htm?id=567637757708&ns=1&abbucket=6
486,雪***3,滋润保湿，改善细纹黑眼圈,2021-05-01 16:02:58,Null,Null,Null,True,1131562067106,False,眼霜,化妆品净含量:魅影紫管,ahc眼霜抗皱细纹去淡化黑眼圈补水保湿学生女第八代8七男眼袋去除,tmall,https://detail.tmall.com/item.htm?id=567637757708&ns=1&abbucket=6
487,小***6,一如既往的支持，已经用了几年的眼霜了。很滋润，很好用。,2021-04-07 14:33:55,Null,Null,Null,True,1127696253213,True,眼霜,化妆品净含量:炫黑黑管,ahc眼霜抗皱细纹去淡化黑眼圈补水保湿学生女第八代8七男眼袋去除,tmall,https://detail.tmall.com/item.htm?id=567637757708&ns=1&abbucket=6
488,w***0,一直都在用这款的紫色的眼霜，这次客服建议买了黑色的，期待效果，这个品牌值得信赖，还会回购的。,2021-03-28 15:52:26,🎄朋友总说要涂眼霜抗衰老🌵一开始还不信直到看到了细纹就买了它🎁用了发现确实不错，现在眼纹淡一点了👻还蛮温和的而且这一支比我想象中分量足，够用💝好评,2021-03-29 17:39:06,1,True,1126837982411,False,眼霜,化妆品净含量:炫黑黑管,ahc眼霜抗皱细纹去淡化黑眼圈补水保湿学生女第八代8七男眼袋去除,tmall,https://detail.tmall.com/item.htm?id=567637757708&ns=1&abbucket=6
489,究***好,闻着没什么味道，用了两次感觉比较滋润，坚持希望有惊喜,2021-05-08 09:10:28,Null,Null,Null,True,1131551393910,False,眼霜,化妆品净含量:炫黑黑管,ahc眼霜抗皱细纹去淡化黑眼圈补水保湿学生女第八代8七男眼袋去除,tmall,https://detail.tmall.com/item.htm?id=567637757708&ns=1&abbucket=6
490,t***4,好用，不错，好评。,2021-05-05 17:44:27,Null,Null,Null,True,1131211377226,False,眼霜,化妆品净含量:炫黑黑管,ahc眼霜抗皱细纹去淡化黑眼圈补水保湿学生女第八代8七男眼袋去除,tmall,https://detail.tmall.com/item.htm?id=567637757708&ns=1&abbucket=6
491,我***我,包装很好，物流也很快，不错   会回购,2021-04-27 23:47:30,Null,Null,Null,True,1129841272859,False,眼霜,化妆品净含量:炫黑黑管,ahc眼霜抗皱细纹去淡化黑眼圈补水保湿学生女第八代8七男眼袋去除,tmall,https://detail.tmall.com/item.htm?id=567637757708&ns=1&abbucket=6
492,宇***儿,之前一直用这款蓝色的，保湿效果很好，随着年纪想换黑色的试试，希望坚持使用有效果吧 包装品质：包装看照片吧 商品气味：清淡的香味过会儿就闻不到了,2021-04-17 15:12:51,Null,Null,Null,True,1128953305186,True,眼霜,化妆品净含量:炫黑黑管,ahc眼霜抗皱细纹去淡化黑眼圈补水保湿学生女第八代8七男眼袋去除,tmall,https://detail.tmall.com/item.htm?id=567637757708&ns=1&abbucket=6
493,角***癫,不怎么样，张脂肪粒，也不能退换,2021-05-08 19:32:57,Null,Null,Null,True,1131639921709,True,眼霜,化妆品净含量:炫黑黑管,ahc眼霜抗皱细纹去淡化黑眼圈补水保湿学生女第八代8七男眼袋去除,tmall,https://detail.tmall.com/item.htm?id=567637757708&ns=1&abbucket=6
494,t***7,宝贝非常好用，这是第二次购买了，用着十勿舒服，感觉很水润,2021-04-08 22:27:32,Null,Null,Null,True,1128310926876,False,眼霜,化妆品净含量:魅影紫管,ahc眼霜抗皱细纹去淡化黑眼圈补水保湿学生女第八代8七男眼袋去除,tmall,https://detail.tmall.com/item.htm?id=567637757708&ns=1&abbucket=6
495,倩***3,很好。特别好用,2021-05-06 17:22:01,Null,Null,Null,True,1132217335105,False,眼霜,化妆品净含量:魅影紫管,ahc眼霜抗皱细纹去淡化黑眼圈补水保湿学生女第八代8七男眼袋去除,tmall,https://detail.tmall.com/item.htm?id=567637757708&ns=1&abbucket=6
496,l***i,用了之后确实有感觉到眼部的紧绷感  还会再次购买的,2021-04-29 11:41:17,Null,Null,Null,True,1129995208018,False,眼霜,化妆品净含量:宝石蓝管,ahc眼霜抗皱细纹去淡化黑眼圈补水保湿学生女第八代8七男眼袋去除,tmall,https://detail.tmall.com/item.htm?id=567637757708&ns=1&abbucket=6
497,t***4,从老爸评测那儿种草这个的👨～平价补水第一名☝ ，挺大一只的，便宜大碗✌，超级喜欢这款眼霜的香味，✨是非常淡雅的清香，闻起来非常高级，😜用着也滋润不油腻，爱了爱了~,2021-03-27 16:56:23,相信老爸测评哈哈，💎真的很优秀呀~,2021-03-27 16:56:44,0,True,1125863228715,False,眼霜,化妆品净含量:魅影紫管,ahc眼霜抗皱细纹去淡化黑眼圈补水保湿学生女第八代8七男眼袋去除,tmall,https://detail.tmall.com/item.htm?id=567637757708&ns=1&abbucket=6
498,t***2,收到了，还不错吧,2021-05-04 16:15:52,Null,Null,Null,True,1131506822490,False,眼霜,化妆品净含量:宝石蓝管,ahc眼霜抗皱细纹去淡化黑眼圈补水保湿学生女第八代8七男眼袋去除,tmall,https://detail.tmall.com/item.htm?id=567637757708&ns=1&abbucket=6
499,且***5,宝贝与描述相符，服务态度好，发货速度快,2021-04-27 12:05:39,Null,Null,Null,True,1130648694841,False,眼霜,化妆品净含量:宝石蓝管,ahc眼霜抗皱细纹去淡化黑眼圈补水保湿学生女第八代8七男眼袋去除,tmall,https://detail.tmall.com/item.htm?id=567637757708&ns=1&abbucket=6
500,w***o,买回来几天了，用了三次，确实感觉眼角的小细纹少了，而且抹上感觉眼皮很紧致，用完兰蔻的小黑瓶，也最多就是这个效果，对于个人来说，确实不错，物美价廉。放心购买。他家的防晒也特别好用 。,2021-04-26 15:21:20,Null,Null,Null,True,1130102369709,True,眼霜,化妆品净含量:炫黑黑管,ahc眼霜抗皱细纹去淡化黑眼圈补水保湿学生女第八代8七男眼袋去除,tmall,https://detail.tmall.com/item.htm?id=567637757708&ns=1&abbucket=6
501,胖***肥,货已收到，包装很好，发货速度很快。 包装品质：很好 商品气味：不错 使用效果：期待效果,2021-04-09 13:36:09,Null,Null,Null,True,1127940089451,False,眼霜,化妆品净含量:宝石蓝管,ahc眼霜抗皱细纹去淡化黑眼圈补水保湿学生女第八代8七男眼袋去除,tmall,https://detail.tmall.com/item.htm?id=567637757708&ns=1&abbucket=6
502,y***1,好用好用，用第三只了，价格实惠，值得拥有,2021-05-02 16:36:56,Null,Null,Null,True,1131679871730,False,眼霜,化妆品净含量:魅影紫管,ahc眼霜抗皱细纹去淡化黑眼圈补水保湿学生女第八代8七男眼袋去除,tmall,https://detail.tmall.com/item.htm?id=567637757708&ns=1&abbucket=6
503,f***6,一直都在用这款眼霜，觉得挺好的，保湿也滋润，淡化眼纹，价格也实惠,2021-04-24 08:41:39,Null,Null,Null,True,1129352664771,True,眼霜,化妆品净含量:魅影紫管,ahc眼霜抗皱细纹去淡化黑眼圈补水保湿学生女第八代8七男眼袋去除,tmall,https://detail.tmall.com/item.htm?id=567637757708&ns=1&abbucket=6
504,t***5,包装品质：黑管磨砂 商品气味：没有什么味道 使用效果：刚使用，暂时没有什么效果，很清爽,2021-04-20 20:51:12,Null,Null,Null,True,1130225031198,False,眼霜,化妆品净含量:炫黑黑管,ahc眼霜抗皱细纹去淡化黑眼圈补水保湿学生女第八代8七男眼袋去除,tmall,https://detail.tmall.com/item.htm?id=567637757708&ns=1&abbucket=6
505,t***8,膏体香香的，涂在眼睛上很温和，不刺激哦，感觉真的有点效果的，希望可以消除浮肿，然后眼睛越来越明亮有神，细纹都有明显的改善，眼周皮肤好很多，上妆不会卡粉，眼袋和黑眼圈能有所改善,2021-03-11 19:08:46,用着还挺温和的，滋润度也不错,2021-03-11 19:09:43,0,True,1124289633328,False,眼霜,化妆品净含量:炫黑黑管,ahc眼霜抗皱细纹去淡化黑眼圈补水保湿学生女第八代8七男眼袋去除,tmall,https://detail.tmall.com/item.htm?id=567637757708&ns=1&abbucket=6
506,y***1,坚持用真的有效果噢 淡细纹淡脂肪粒,2021-04-28 08:27:19,Null,Null,Null,True,1130743898465,False,眼霜,化妆品净含量:魅影紫管,ahc眼霜抗皱细纹去淡化黑眼圈补水保湿学生女第八代8七男眼袋去除,tmall,https://detail.tmall.com/item.htm?id=567637757708&ns=1&abbucket=6
507,t***1,宝贝收到了，包装很好，用起来很香，物流很给力两天就到了，正品的东西就是好👌,2021-04-21 19:31:52,Null,Null,Null,True,1129064228172,False,眼霜,化妆品净含量:宝石蓝管,ahc眼霜抗皱细纹去淡化黑眼圈补水保湿学生女第八代8七男眼袋去除,tmall,https://detail.tmall.com/item.htm?id=567637757708&ns=1&abbucket=6
508,t***0,此用户没有填写评论!,2020-12-06 15:17:44,好用，不油,2021-05-01 00:15:44,160,True,1130196976854,False,眼霜,化妆品净含量:魅影紫管,ahc眼霜抗皱细纹去淡化黑眼圈补水保湿学生女第八代8七男眼袋去除,tmall,https://detail.tmall.com/item.htm?id=567637757708&ns=1&abbucket=6
509,z***1,心里感觉用着比没用好，看着有什么效果倒不明显,2021-05-08 14:58:18,Null,Null,Null,True,1131602445341,False,眼霜,化妆品净含量:宝石蓝管,ahc眼霜抗皱细纹去淡化黑眼圈补水保湿学生女第八代8七男眼袋去除,tmall,https://detail.tmall.com/item.htm?id=567637757708&ns=1&abbucket=6
510,酸***i,&zwnj;收到货，第一时间拆包装，感觉质量还是比较好的，与卖家描述的还是一致的，非常满意，发货速度比较快，物流公司服务态度还行，运送速度还行，总的来说这次是很满意的一次购物，感谢感谢感谢感谢。哈哈哈哈哈哈&nbsp;哈哈哈,2021-04-26 15:44:02,Null,Null,Null,True,1130552926321,False,眼霜,化妆品净含量:炫黑黑管,ahc眼霜抗皱细纹去淡化黑眼圈补水保湿学生女第八代8七男眼袋去除,tmall,https://detail.tmall.com/item.htm?id=567637757708&ns=1&abbucket=6
511,t***1,味道挺好闻的，保湿作用挺好，干纹微微淡化了,2021-05-02 23:35:48,Null,Null,Null,True,1130422572524,False,眼霜,化妆品净含量:魅影紫管,ahc眼霜抗皱细纹去淡化黑眼圈补水保湿学生女第八代8七男眼袋去除,tmall,https://detail.tmall.com/item.htm?id=567637757708&ns=1&abbucket=6
512,呼***曼,看着包装就满精致的了，🌲收到就觉得不错的，眼霜质地很好吸收的呢，用完皮肤很滋润保湿的，就取一点点点涂在眼周按摩，🍁吸收很快的呢，🌟可以很好的缓解眼周的肌肤干燥了，最近护肤的时候搭配用满滋润的🌷,2021-03-17 19:38:07,满细腻的一款眼霜，很温和，也不会起脂肪粒，效果很好,2021-03-17 19:38:42,0,True,1125754611096,False,眼霜,化妆品净含量:炫黑黑管,ahc眼霜抗皱细纹去淡化黑眼圈补水保湿学生女第八代8七男眼袋去除,tmall,https://detail.tmall.com/item.htm?id=567637757708&ns=1&abbucket=6
513,青***心,淡淡的香味，很好闻，才开始用，期待效果。,2021-04-29 14:08:51,Null,Null,Null,True,1130455201095,False,眼霜,化妆品净含量:炫黑黑管,ahc眼霜抗皱细纹去淡化黑眼圈补水保湿学生女第八代8七男眼袋去除,tmall,https://detail.tmall.com/item.htm?id=567637757708&ns=1&abbucket=6
514,e***香,喜欢黑瓶的😁😁😁,2021-05-06 21:37:54,Null,Null,Null,True,1132246827254,False,眼霜,化妆品净含量:炫黑黑管,ahc眼霜抗皱细纹去淡化黑眼圈补水保湿学生女第八代8七男眼袋去除,tmall,https://detail.tmall.com/item.htm?id=567637757708&ns=1&abbucket=6
515,琪***妞,物流快，价格很实惠,2021-05-03 15:50:56,Null,Null,Null,True,1130492696125,True,眼霜,化妆品净含量:宝石蓝管,ahc眼霜抗皱细纹去淡化黑眼圈补水保湿学生女第八代8七男眼袋去除,tmall,https://detail.tmall.com/item.htm?id=567637757708&ns=1&abbucket=6
516,雪***6,一直都在这家买，是真品，价格实惠，回购中！,2021-04-25 17:00:45,Null,Null,Null,True,1129549568080,False,眼霜,化妆品净含量:炫黑黑管,ahc眼霜抗皱细纹去淡化黑眼圈补水保湿学生女第八代8七男眼袋去除,tmall,https://detail.tmall.com/item.htm?id=567637757708&ns=1&abbucket=6
517,t***2,非常好，小黑管，保湿程度还不错，是正品，很满意  包装也不错,2021-04-19 10:43:56,Null,Null,Null,True,1130009019080,False,眼霜,化妆品净含量:炫黑黑管,ahc眼霜抗皱细纹去淡化黑眼圈补水保湿学生女第八代8七男眼袋去除,tmall,https://detail.tmall.com/item.htm?id=567637757708&ns=1&abbucket=6
518,t***7,包装很好，试了一下很好用，很保湿,2021-04-06 00:07:53,早上试了一下，挺好用的,2021-04-06 13:48:04,0,True,1127933358882,False,眼霜,化妆品净含量:宝石蓝管,ahc眼霜抗皱细纹去淡化黑眼圈补水保湿学生女第八代8七男眼袋去除,tmall,https://detail.tmall.com/item.htm?id=567637757708&ns=1&abbucket=6
519,t***3,味道香香的很喜欢，第一次用希望会有效果,2021-04-28 15:07:00,Null,Null,Null,True,1129904760642,False,眼霜,化妆品净含量:魅影紫管,ahc眼霜抗皱细纹去淡化黑眼圈补水保湿学生女第八代8七男眼袋去除,tmall,https://detail.tmall.com/item.htm?id=567637757708&ns=1&abbucket=6
520,过***伤,入手了很多的东西呢，🌹这款水乳是很喜欢的，🌟洗面奶泡泡蛮多的，洗的很干净呢，水乳上脸很好吸收的，🍀用完皮肤很润的，搭配精华补水效果很好的呢，🌹还入手了眼霜和面霜，搭配用护肤一套齐啦💎，可以很好的改善肌肤了呢🍁，jm的卸妆水是朋友推荐的🍃，用的很清爽的，卸妆力也是很好的，淡妆浓妆都卸的很干净🌺,2021-03-05 16:33:04,效果都是很喜欢的呢，还会回购的，性价比很高的了，每次护肤都感觉肤感很好的,2021-03-05 16:34:34,2,True,1123282932730,False,眼霜,化妆品净含量:宝石蓝管,ahc眼霜抗皱细纹去淡化黑眼圈补水保湿学生女第八代8七男眼袋去除,tmall,https://detail.tmall.com/item.htm?id=567637757708&ns=1&abbucket=6
521,王***贝,精致眼霜非常好，已经实验非常棒👍用完还会购物👏,2021-03-29 15:15:10,Null,Null,Null,True,1126099560154,False,眼霜,化妆品净含量:魅影紫管,ahc眼霜抗皱细纹去淡化黑眼圈补水保湿学生女第八代8七男眼袋去除,tmall,https://detail.tmall.com/item.htm?id=567637757708&ns=1&abbucket=6
522,笑***寞,使用效果：还不错，味道挺好闻得,2021-04-28 22:04:32,Null,Null,Null,True,1130395229193,False,眼霜,化妆品净含量:魅影紫管,ahc眼霜抗皱细纹去淡化黑眼圈补水保湿学生女第八代8七男眼袋去除,tmall,https://detail.tmall.com/item.htm?id=567637757708&ns=1&abbucket=6
523,t***1,看到别人一直在用，所以购买，期待效果！,2021-05-02 20:42:21,Null,Null,Null,True,1130850253357,False,眼霜,化妆品净含量:炫黑黑管,ahc眼霜抗皱细纹去淡化黑眼圈补水保湿学生女第八代8七男眼袋去除,tmall,https://detail.tmall.com/item.htm?id=567637757708&ns=1&abbucket=6
524,杨***3,味道很好闻 淡淡的 期待效果,2021-04-28 18:26:40,Null,Null,Null,True,1129930664945,False,眼霜,化妆品净含量:炫黑黑管,ahc眼霜抗皱细纹去淡化黑眼圈补水保湿学生女第八代8七男眼袋去除,tmall,https://detail.tmall.com/item.htm?id=567637757708&ns=1&abbucket=6
525,心***9,味道好闻淡淡的香，期待效果。,2021-04-28 10:36:31,Null,Null,Null,True,1130759950800,False,眼霜,化妆品净含量:炫黑黑管,ahc眼霜抗皱细纹去淡化黑眼圈补水保湿学生女第八代8七男眼袋去除,tmall,https://detail.tmall.com/item.htm?id=567637757708&ns=1&abbucket=6
526,z***0,发货速度也太快了眼霜有股淡淡的清香我很喜欢,2021-04-27 22:04:19,Null,Null,Null,True,1129833688529,False,眼霜,化妆品净含量:宝石蓝管,ahc眼霜抗皱细纹去淡化黑眼圈补水保湿学生女第八代8七男眼袋去除,tmall,https://detail.tmall.com/item.htm?id=567637757708&ns=1&abbucket=6
527,花***s,眼霜用着还不错，蛮滋润保湿，质地是那种稍微有点粘稠，但是涂开吸收后还是可以接受的，也很好吸收。,2021-04-24 21:17:16,Null,Null,Null,True,1129452332555,True,眼霜,化妆品净含量:炫黑黑管,ahc眼霜抗皱细纹去淡化黑眼圈补水保湿学生女第八代8七男眼袋去除,tmall,https://detail.tmall.com/item.htm?id=567637757708&ns=1&abbucket=6
528,爱***3,眼霜是平时必备的了，🍁护肤的时候搭配一起用的，入手了很多ahc的产品💎，就回购了这款，点图在眼周很好吸收的，用完皮肤很水润保湿的⚡，可以很好的保湿眼周了🌹,2021-05-07 14:27:00,眼霜是很重要的了，平时一定要搭配用的,2021-05-07 14:27:13,0,True,1131465889358,False,眼霜,化妆品净含量:炫黑黑管,ahc眼霜抗皱细纹去淡化黑眼圈补水保湿学生女第八代8七男眼袋去除,tmall,https://detail.tmall.com/item.htm?id=567637757708&ns=1&abbucket=6
529,小***1,第二次买了 第一次买的黑管这次试一试蓝管 蓝色没有黑色的味道香哦,2021-05-05 20:52:17,Null,Null,Null,True,1131690526782,False,眼霜,化妆品净含量:宝石蓝管,ahc眼霜抗皱细纹去淡化黑眼圈补水保湿学生女第八代8七男眼袋去除,tmall,https://detail.tmall.com/item.htm?id=567637757708&ns=1&abbucket=6
530,l***9,包装特别精致，味道很香，物流也非常给力，真的很不错，还会回购哦😄😄😄,2021-04-21 21:43:28,Null,Null,Null,True,1129077744513,False,眼霜,化妆品净含量:炫黑黑管,ahc眼霜抗皱细纹去淡化黑眼圈补水保湿学生女第八代8七男眼袋去除,tmall,https://detail.tmall.com/item.htm?id=567637757708&ns=1&abbucket=6
531,c***7,这款眼霜整体是很清爽的👘，乳霜的质地，挤黄豆粒大小就够用🎒了，轻轻按摩至吸👕收，吸收的还是很好的，抹完会觉得眼周肌🌂肤水润润的。很适合熬夜和眼周干燥的妹子~👒,2021-03-16 17:10:59,这款保湿性很好💋，值得回购的一款眼霜,2021-03-16 17:12:56,0,True,1125224674203,False,眼霜,化妆品净含量:魅影紫管,ahc眼霜抗皱细纹去淡化黑眼圈补水保湿学生女第八代8七男眼袋去除,tmall,https://detail.tmall.com/item.htm?id=567637757708&ns=1&abbucket=6
532,h***i,保湿 商品气味：挺香的 包装品质：能扫码，正品,2021-04-18 13:45:26,Null,Null,Null,True,1129905539119,False,眼霜,化妆品净含量:炫黑黑管,ahc眼霜抗皱细纹去淡化黑眼圈补水保湿学生女第八代8七男眼袋去除,tmall,https://detail.tmall.com/item.htm?id=567637757708&ns=1&abbucket=6
533,0***太,眼膜没入坑用着效果也不错,2021-04-29 11:25:03,Null,Null,Null,True,1129993400417,False,眼霜,化妆品净含量:魅影紫管,ahc眼霜抗皱细纹去淡化黑眼圈补水保湿学生女第八代8七男眼袋去除,tmall,https://detail.tmall.com/item.htm?id=567637757708&ns=1&abbucket=6
534,倾***凉,已经回购第二次了  以后就坚持用这个眼霜 别的眼霜没有这个细腻 而且保湿效果非常好 一管用完细纹也有明显效果,2021-04-18 10:18:48,Null,Null,Null,True,1128601140709,False,眼霜,化妆品净含量:宝石蓝管,ahc眼霜抗皱细纹去淡化黑眼圈补水保湿学生女第八代8七男眼袋去除,tmall,https://detail.tmall.com/item.htm?id=567637757708&ns=1&abbucket=6
535,天***子,眼霜是护肤必备的，这款也是看很多人推的，买了紫色的，点涂在眼周搭配按摩吸收很快的了， 滋润度不错。,2021-04-25 14:25:12,Null,Null,Null,True,1129525156822,False,眼霜,化妆品净含量:魅影紫管,ahc眼霜抗皱细纹去淡化黑眼圈补水保湿学生女第八代8七男眼袋去除,tmall,https://detail.tmall.com/item.htm?id=567637757708&ns=1&abbucket=6
