index,用户昵称,初评,初评日期,追评,追评日期,追评天数,是否有用,用户id,超级会员,产品,类别,标题,平台,商品链接
962,t***7,收到货了，还没使用，用完看看,2021-05-05 11:30:12,Null,Null,Null,True,1130702804817,False,眼霜,化妆品净含量:炫黑黑管,ahc眼霜抗皱细纹去淡化黑眼圈补水保湿学生女第八代8七男眼袋去除,tmall,https://detail.tmall.com/item.htm?id=567637757708&ns=1&abbucket=6
963,z***。,🙂🙂,2021-05-02 17:50:10,味道很好闻🙂🙂,2021-05-02 17:53:15,0,True,1130834077366,False,眼霜,化妆品净含量:炫黑黑管,ahc眼霜抗皱细纹去淡化黑眼圈补水保湿学生女第八代8七男眼袋去除,tmall,https://detail.tmall.com/item.htm?id=567637757708&ns=1&abbucket=6
964,t***5,正品保真，已经是第四次次购买他们家的产品了 下次还会在买,2021-04-13 00:44:08,Null,Null,Null,True,1128832010822,False,眼霜,化妆品净含量:炫黑黑管,ahc眼霜抗皱细纹去淡化黑眼圈补水保湿学生女第八代8七男眼袋去除,tmall,https://detail.tmall.com/item.htm?id=567637757708&ns=1&abbucket=6
965,t***4,第一感觉就是包装漂亮，第二感觉就是香香的！特别容易推开。我黑眼圈有点重，正好试试这个(*˘︶˘*).。.：*♡,2021-04-04 17:56:51,Null,Null,Null,True,1126904892754,False,眼霜,化妆品净含量:宝石蓝管,ahc眼霜抗皱细纹去淡化黑眼圈补水保湿学生女第八代8七男眼袋去除,tmall,https://detail.tmall.com/item.htm?id=567637757708&ns=1&abbucket=6
966,t***1,刚收到在手上使用了一下很水润 不油腻,2021-04-06 12:14:31,Null,Null,Null,True,1128378067067,False,眼霜,化妆品净含量:炫黑黑管,ahc眼霜抗皱细纹去淡化黑眼圈补水保湿学生女第八代8七男眼袋去除,tmall,https://detail.tmall.com/item.htm?id=567637757708&ns=1&abbucket=6
967,思***7,包装品质：包装很严实 商品气味：味道很轻淡 使用效果：很好啦 建议大家购买呦,2021-04-07 16:06:28,Null,Null,Null,True,1128141778016,False,眼霜,化妆品净含量:魅影紫管,ahc眼霜抗皱细纹去淡化黑眼圈补水保湿学生女第八代8七男眼袋去除,tmall,https://detail.tmall.com/item.htm?id=567637757708&ns=1&abbucket=6
968,人***心,挺好的第二次回购了 是正品一直在他家购买还会回购的！,2021-03-30 08:24:39,Null,Null,Null,True,1127034646905,False,眼霜,化妆品净含量:魅影紫管,ahc眼霜抗皱细纹去淡化黑眼圈补水保湿学生女第八代8七男眼袋去除,tmall,https://detail.tmall.com/item.htm?id=567637757708&ns=1&abbucket=6
969,敏***i,以前在澳门买货 挺好用的。现在用完了 就在网上买 查了一下 是正品,2021-04-13 15:51:32,Null,Null,Null,True,1128031988905,False,眼霜,化妆品净含量:魅影紫管,ahc眼霜抗皱细纹去淡化黑眼圈补水保湿学生女第八代8七男眼袋去除,tmall,https://detail.tmall.com/item.htm?id=567637757708&ns=1&abbucket=6
970,2***3,很好，买第二次了,2021-04-18 12:12:41,Null,Null,Null,True,1129491870142,False,眼霜,化妆品净含量:炫黑黑管,ahc眼霜抗皱细纹去淡化黑眼圈补水保湿学生女第八代8七男眼袋去除,tmall,https://detail.tmall.com/item.htm?id=567637757708&ns=1&abbucket=6
971,浅***5,在小红书上看了好久才选定这款，价格很合适，保湿的效果也不错，对于想要初抗老的我很合适了。,2021-04-08 17:39:50,Null,Null,Null,True,1128679691020,False,眼霜,化妆品净含量:魅影紫管,ahc眼霜抗皱细纹去淡化黑眼圈补水保湿学生女第八代8七男眼袋去除,tmall,https://detail.tmall.com/item.htm?id=567637757708&ns=1&abbucket=6
972,t***1,包装很好没有损坏，挤出方式也很简单方便，身边的人都说效果很好，期待,2021-04-07 19:22:39,Null,Null,Null,True,1127299512806,False,眼霜,化妆品净含量:宝石蓝管,ahc眼霜抗皱细纹去淡化黑眼圈补水保湿学生女第八代8七男眼袋去除,tmall,https://detail.tmall.com/item.htm?id=567637757708&ns=1&abbucket=6
973,a***0,物流很快，使用一段时间看效果，别人推荐来的 包装品质：优良，外观漂亮 商品气味：淡淡幽香,2021-04-06 11:07:15,Null,Null,Null,True,1127102008246,False,眼霜,化妆品净含量:魅影紫管,ahc眼霜抗皱细纹去淡化黑眼圈补水保湿学生女第八代8七男眼袋去除,tmall,https://detail.tmall.com/item.htm?id=567637757708&ns=1&abbucket=6
974,t***3,包装品质：很好 商品气味：清香 使用效果：我觉得有效果，第二次购买了呦,2021-04-10 16:27:20,Null,Null,Null,True,1128921963670,False,眼霜,化妆品净含量:宝石蓝管,ahc眼霜抗皱细纹去淡化黑眼圈补水保湿学生女第八代8七男眼袋去除,tmall,https://detail.tmall.com/item.htm?id=567637757708&ns=1&abbucket=6
975,王***9,产品很好用，效果不错，适合熬夜的人群,2021-03-14 09:34:36,Null,Null,Null,True,1124964690112,False,眼霜,化妆品净含量:炫黑黑管,ahc眼霜抗皱细纹去淡化黑眼圈补水保湿学生女第八代8七男眼袋去除,tmall,https://detail.tmall.com/item.htm?id=567637757708&ns=1&abbucket=6
976,t***1,好用，物美价廉,2021-04-18 20:32:08,Null,Null,Null,True,1129559482316,False,眼霜,化妆品净含量:炫黑黑管,ahc眼霜抗皱细纹去淡化黑眼圈补水保湿学生女第八代8七男眼袋去除,tmall,https://detail.tmall.com/item.htm?id=567637757708&ns=1&abbucket=6
977,t***4,很香，我喜欢这个味道，淡淡的。也不是很油，很滋润，我是油皮，而且我是夏天用的，我感觉我能接受。我个人觉得会淡黑眼圈，细纹我就不清楚了，表示我还没有皱纹。,2021-03-29 10:08:57,Null,Null,Null,True,1126054968101,False,眼霜,化妆品净含量:魅影紫管,ahc眼霜抗皱细纹去淡化黑眼圈补水保湿学生女第八代8七男眼袋去除,tmall,https://detail.tmall.com/item.htm?id=567637757708&ns=1&abbucket=6
978,平***9,清爽不腻，好用，不会像其他的胡眼睛,2021-04-14 16:51:18,Null,Null,Null,True,1128165128269,False,眼霜,化妆品净含量:炫黑黑管,ahc眼霜抗皱细纹去淡化黑眼圈补水保湿学生女第八代8七男眼袋去除,tmall,https://detail.tmall.com/item.htm?id=567637757708&ns=1&abbucket=6
979,溱***9,骚粉还是很好看的 老牌子了 效果也是不错的 一直有在回购！,2021-03-28 22:27:30,Null,Null,Null,True,1126885994047,False,眼霜,化妆品净含量:魅影紫管,ahc眼霜抗皱细纹去淡化黑眼圈补水保湿学生女第八代8七男眼袋去除,tmall,https://detail.tmall.com/item.htm?id=567637757708&ns=1&abbucket=6
980,爱***7,超级实惠好用的眼霜   包装品质：简单大气 商品气味：淡淡的味道 使用效果：眼周很滋润,2021-04-13 18:11:07,好用好用好用,2021-04-13 18:12:03,0,True,1128922534175,True,眼霜,化妆品净含量:炫黑黑管,ahc眼霜抗皱细纹去淡化黑眼圈补水保湿学生女第八代8七男眼袋去除,tmall,https://detail.tmall.com/item.htm?id=567637757708&ns=1&abbucket=6
981,海***4,宝贝已收到，卖家服务好，发货快,2021-04-20 18:53:38,Null,Null,Null,True,1128932300828,False,眼霜,化妆品净含量:魅影紫管,ahc眼霜抗皱细纹去淡化黑眼圈补水保湿学生女第八代8七男眼袋去除,tmall,https://detail.tmall.com/item.htm?id=567637757708&ns=1&abbucket=6
982,t***8,特别好用  黑眼圈不见了,2021-03-22 21:18:37,Null,Null,Null,True,1126429827657,False,眼霜,化妆品净含量:炫黑黑管,ahc眼霜抗皱细纹去淡化黑眼圈补水保湿学生女第八代8七男眼袋去除,tmall,https://detail.tmall.com/item.htm?id=567637757708&ns=1&abbucket=6
983,r***o,不错，还可以,2021-04-18 16:26:27,Null,Null,Null,True,1129930035219,False,眼霜,化妆品净含量:炫黑黑管,ahc眼霜抗皱细纹去淡化黑眼圈补水保湿学生女第八代8七男眼袋去除,tmall,https://detail.tmall.com/item.htm?id=567637757708&ns=1&abbucket=6
984,陌***喵,挺好用的，喜欢,2021-04-20 12:11:27,Null,Null,Null,True,1129309925827,False,眼霜,化妆品净含量:炫黑黑管,ahc眼霜抗皱细纹去淡化黑眼圈补水保湿学生女第八代8七男眼袋去除,tmall,https://detail.tmall.com/item.htm?id=567637757708&ns=1&abbucket=6
985,t***6,物流很快，包装也很好，试用了一下，没有感觉不适，香味淡淡的很好闻，效果要用一段时间才知道。,2021-04-11 09:25:42,Null,Null,Null,True,1128988207110,False,眼霜,化妆品净含量:宝石蓝管,ahc眼霜抗皱细纹去淡化黑眼圈补水保湿学生女第八代8七男眼袋去除,tmall,https://detail.tmall.com/item.htm?id=567637757708&ns=1&abbucket=6
986,快***6,效果很好，也挺便宜，想买的可以下手了,2021-04-09 19:08:38,Null,Null,Null,True,1127549396464,False,眼霜,化妆品净含量:炫黑黑管,ahc眼霜抗皱细纹去淡化黑眼圈补水保湿学生女第八代8七男眼袋去除,tmall,https://detail.tmall.com/item.htm?id=567637757708&ns=1&abbucket=6
987,t***此,眼霜入手很划算，也挺好🍵🍶用的，质地属于很水润清爽的那种，蛮好吸收的，一共🍱🍘三款可以选择的，买的黑色的，味道也是我喜欢的，挺好闻的，保🍒🍓湿效果很好了，对于这个价位来说🍊很值了,2021-02-06 14:46:00,很好吸🍔🍟收，不用担心会长脂肪粒🍢🍣，是很清爽的质地,2021-02-06 14:46:57,0,True,1121201568345,False,眼霜,化妆品净含量:炫黑黑管,ahc眼霜抗皱细纹去淡化黑眼圈补水保湿学生女第八代8七男眼袋去除,tmall,https://detail.tmall.com/item.htm?id=567637757708&ns=1&abbucket=6
988,胡***贵,个人觉得还挺滋润的一款眼霜，没有出现长脂肪粒的现象，值得推荐。,2021-04-05 21:19:22,Null,Null,Null,True,1127487681409,False,眼霜,化妆品净含量:魅影紫管,ahc眼霜抗皱细纹去淡化黑眼圈补水保湿学生女第八代8七男眼袋去除,tmall,https://detail.tmall.com/item.htm?id=567637757708&ns=1&abbucket=6
989,萌***7,包装品质：包装完好无损，郑州菜鸟保税仓发货 使用效果：好多人推荐，已买过，用了两次还不错,2021-03-30 22:25:36,Null,Null,Null,True,1127550547448,False,眼霜,化妆品净含量:宝石蓝管,ahc眼霜抗皱细纹去淡化黑眼圈补水保湿学生女第八代8七男眼袋去除,tmall,https://detail.tmall.com/item.htm?id=567637757708&ns=1&abbucket=6
990,恬***3,刚开始用，感觉效果还不错，也不厚重，滋润易推开，挺好！,2021-04-12 19:52:26,Null,Null,Null,True,1128806850254,False,眼霜,化妆品净含量:宝石蓝管,ahc眼霜抗皱细纹去淡化黑眼圈补水保湿学生女第八代8七男眼袋去除,tmall,https://detail.tmall.com/item.htm?id=567637757708&ns=1&abbucket=6
991,t***2,很好，物流很快，两天就收到了。,2021-05-02 17:02:36,Null,Null,Null,True,1131275678858,False,眼霜,化妆品净含量:宝石蓝管,ahc眼霜抗皱细纹去淡化黑眼圈补水保湿学生女第八代8七男眼袋去除,tmall,https://detail.tmall.com/item.htm?id=567637757708&ns=1&abbucket=6
992,t***0,一直用这个眼霜，保湿很好，也不长脂肪粒,2021-04-02 21:46:57,Null,Null,Null,True,1126684256264,False,眼霜,化妆品净含量:炫黑黑管,ahc眼霜抗皱细纹去淡化黑眼圈补水保湿学生女第八代8七男眼袋去除,tmall,https://detail.tmall.com/item.htm?id=567637757708&ns=1&abbucket=6
993,勋***2,挺好的，味道是我喜欢的！赶快购买吧！不要犹豫喔！适合学生党嘞！快买吧！美女们哈哈哈哈,2021-04-02 12:39:01,Null,Null,Null,True,1127039585744,False,眼霜,化妆品净含量:炫黑黑管,ahc眼霜抗皱细纹去淡化黑眼圈补水保湿学生女第八代8七男眼袋去除,tmall,https://detail.tmall.com/item.htm?id=567637757708&ns=1&abbucket=6
994,娉***笑,是正品呦。全是韩文看不懂。等我用完再评。,2021-04-04 21:25:46,Null,Null,Null,True,1127792858287,False,眼霜,化妆品净含量:宝石蓝管,ahc眼霜抗皱细纹去淡化黑眼圈补水保湿学生女第八代8七男眼袋去除,tmall,https://detail.tmall.com/item.htm?id=567637757708&ns=1&abbucket=6
995,付***默,商品气味：很好闻 包装品质：包装很好  物流很快就收到了，发货神速，收到挺好用的，下次尝试其他两种样式的&bull;,2021-04-01 22:19:52,Null,Null,Null,True,1126555948039,False,眼霜,化妆品净含量:炫黑黑管,ahc眼霜抗皱细纹去淡化黑眼圈补水保湿学生女第八代8七男眼袋去除,tmall,https://detail.tmall.com/item.htm?id=567637757708&ns=1&abbucket=6
996,t***4,还可以，很容易吸收，期待之后的效果，也不贵，喜欢的宝宝们要下单哦,2021-04-06 18:18:40,Null,Null,Null,True,1127166620082,False,眼霜,化妆品净含量:炫黑黑管,ahc眼霜抗皱细纹去淡化黑眼圈补水保湿学生女第八代8七男眼袋去除,tmall,https://detail.tmall.com/item.htm?id=567637757708&ns=1&abbucket=6
997,野***2,感谢我住在不打烊地区哈哈哈，✨看了老爸测评，然后入了这个眼霜🎵，这是我第一只眼霜，🎸先选个性价比高的试试吧，🍳身边也有朋友在用，🍻眼霜很细腻，质地也不油腻，💎擦上很好吸收，👑我眼周没有什么细纹，🚀只是有点点修仙修出来的黑眼圈，我一定要坚持用~,2021-02-16 21:36:35,真的是我对比多个眼霜，挑的性价比最高的，🍻保湿很好，姐妹们可以搞,2021-02-16 21:37:03,0,True,1123218199438,False,眼霜,化妆品净含量:魅影紫管,ahc眼霜抗皱细纹去淡化黑眼圈补水保湿学生女第八代8七男眼袋去除,tmall,https://detail.tmall.com/item.htm?id=567637757708&ns=1&abbucket=6
998,t***4,眼霜包装的挺好的，🍓🍅很喜欢啦，这款眼霜的保湿滋润度很优秀了，味道也蛮好闻的，一支眼☁☁霜的容量也很大了，前面设计的开口是扁的，这样就很🍋🍌方便控制用量了，质🍤🍤地很清爽特别好吸收,2021-02-09 11:52:20,滋润保湿，🍨蛮不错的，性价比也特别的好,2021-02-09 11:52:53,0,True,1122668635680,False,眼霜,化妆品净含量:魅影紫管,ahc眼霜抗皱细纹去淡化黑眼圈补水保湿学生女第八代8七男眼袋去除,tmall,https://detail.tmall.com/item.htm?id=567637757708&ns=1&abbucket=6
999,刘***焱,是AHC眼霜的忠实粉丝了，🍁我亲眼目睹它出到了第八代。眼霜是挺滋润的，💎乳液质地超级细腻。水水润润的容量也可以。去黑眼圈很明显，⚽⚡温和补水不刺激。香味淡淡的很清新，🎅一点也不刺激很舒服。温和好吸收，也没有长脂肪粒。💃,2021-03-07 16:51:02,颜值很高，黑色的包装酷酷的。💍🌂还会继续支持的，用了好几年的眼霜了。,2021-03-07 16:52:02,0,True,1123863733533,False,眼霜,化妆品净含量:炫黑黑管,ahc眼霜抗皱细纹去淡化黑眼圈补水保湿学生女第八代8七男眼袋去除,tmall,https://detail.tmall.com/item.htm?id=567637757708&ns=1&abbucket=6
1000,f***u,包装很赞哦，之前买过很好用，保湿效果好，易抹开,2021-04-04 19:09:11,Null,Null,Null,True,1126912532887,False,眼霜,化妆品净含量:宝石蓝管,ahc眼霜抗皱细纹去淡化黑眼圈补水保湿学生女第八代8七男眼袋去除,tmall,https://detail.tmall.com/item.htm?id=567637757708&ns=1&abbucket=6
1001,t***8,特别喜欢，很滋润，黑眼圈也好多了。太喜欢了,2021-03-28 14:17:17,Null,Null,Null,True,1125962460770,False,眼霜,化妆品净含量:魅影紫管,ahc眼霜抗皱细纹去淡化黑眼圈补水保湿学生女第八代8七男眼袋去除,tmall,https://detail.tmall.com/item.htm?id=567637757708&ns=1&abbucket=6
1002,h***8,包装品质：高大尚 商品气味：好 使用效果：好,2021-04-05 15:42:21,Null,Null,Null,True,1127443445373,False,眼霜,化妆品净含量:魅影紫管,ahc眼霜抗皱细纹去淡化黑眼圈补水保湿学生女第八代8七男眼袋去除,tmall,https://detail.tmall.com/item.htm?id=567637757708&ns=1&abbucket=6
1003,半***0,这个眼霜还可以，保湿，而且味道很好闻。,2021-04-13 16:26:09,Null,Null,Null,True,1128908206186,False,眼霜,化妆品净含量:魅影紫管,ahc眼霜抗皱细纹去淡化黑眼圈补水保湿学生女第八代8七男眼袋去除,tmall,https://detail.tmall.com/item.htm?id=567637757708&ns=1&abbucket=6
1004,t***0,两天就收到了 很好用 滋润易推开 性价比很高,2021-04-11 18:28:33,Null,Null,Null,True,1129065159539,False,眼霜,化妆品净含量:魅影紫管,ahc眼霜抗皱细纹去淡化黑眼圈补水保湿学生女第八代8七男眼袋去除,tmall,https://detail.tmall.com/item.htm?id=567637757708&ns=1&abbucket=6
1005,t***4,包装品质：满意 商品气味：可以 使用效果：还没有用，期待效果,2021-03-30 23:27:46,Null,Null,Null,True,1126727541296,False,眼霜,化妆品净含量:魅影紫管,ahc眼霜抗皱细纹去淡化黑眼圈补水保湿学生女第八代8七男眼袋去除,tmall,https://detail.tmall.com/item.htm?id=567637757708&ns=1&abbucket=6
1006,t***5,这是第二次购买了，之前那一瓶用完了，感觉挺不错。希望持续有更好的效果。,2021-03-31 23:34:53,Null,Null,Null,True,1126859809033,True,眼霜,化妆品净含量:宝石蓝管,ahc眼霜抗皱细纹去淡化黑眼圈补水保湿学生女第八代8七男眼袋去除,tmall,https://detail.tmall.com/item.htm?id=567637757708&ns=1&abbucket=6
1007,t***9,包装品质：黑色很高大上 商品气味：香香的闻着,2021-03-30 14:13:52,Null,Null,Null,True,1126226372108,False,眼霜,化妆品净含量:炫黑黑管,ahc眼霜抗皱细纹去淡化黑眼圈补水保湿学生女第八代8七男眼袋去除,tmall,https://detail.tmall.com/item.htm?id=567637757708&ns=1&abbucket=6
1008,h***9,儿子也用，价格优惠，效果不错,2021-03-06 13:22:35,Null,Null,Null,True,1123342000169,False,眼霜,化妆品净含量:魅影紫管,ahc眼霜抗皱细纹去淡化黑眼圈补水保湿学生女第八代8七男眼袋去除,tmall,https://detail.tmall.com/item.htm?id=567637757708&ns=1&abbucket=6
1009,t***4,眼霜是护肤必备的啦，眼周的肌肤护肤很重要的，这款包装还是满精致的，上脸很好吸收的，按摩至吸收，满滋润保湿的，用在眼周肌肤很润的，改善的也是很好的呢,2021-03-12 13:28:10,用完还会回购的，性价比很高的一款眼霜了,2021-03-12 13:29:53,0,True,1124359417585,False,眼霜,化妆品净含量:魅影紫管,ahc眼霜抗皱细纹去淡化黑眼圈补水保湿学生女第八代8七男眼袋去除,tmall,https://detail.tmall.com/item.htm?id=567637757708&ns=1&abbucket=6
1010,t***6,这个眼霜味道很好闻 ，是我第二次买这种眼霜了 ，对细纹挺管用的,2021-03-30 21:59:25,Null,Null,Null,True,1127152546426,False,眼霜,化妆品净含量:炫黑黑管,ahc眼霜抗皱细纹去淡化黑眼圈补水保湿学生女第八代8七男眼袋去除,tmall,https://detail.tmall.com/item.htm?id=567637757708&ns=1&abbucket=6
1011,美***湖,包装的挺好的，味道还行，挺滋润的,2021-04-06 21:54:37,Null,Null,Null,True,1128058190629,False,眼霜,化妆品净含量:魅影紫管,ahc眼霜抗皱细纹去淡化黑眼圈补水保湿学生女第八代8七男眼袋去除,tmall,https://detail.tmall.com/item.htm?id=567637757708&ns=1&abbucket=6
1012,t***3,买给姐姐用的，我也没看到实物，她说还不错，应该还可以吧，没拍图片就用一张红月亮来代替吧,2021-04-02 10:59:12,Null,Null,Null,True,1127025557438,True,眼霜,化妆品净含量:魅影紫管,ahc眼霜抗皱细纹去淡化黑眼圈补水保湿学生女第八代8七男眼袋去除,tmall,https://detail.tmall.com/item.htm?id=567637757708&ns=1&abbucket=6
1013,t***3,我很喜欢，朋友用的挺好推荐我的,2021-03-26 22:03:30,Null,Null,Null,True,1126202893411,False,眼霜,化妆品净含量:炫黑黑管,ahc眼霜抗皱细纹去淡化黑眼圈补水保湿学生女第八代8七男眼袋去除,tmall,https://detail.tmall.com/item.htm?id=567637757708&ns=1&abbucket=6
1014,我***9,这是第二次购买，用了没有脂肪粒，眼部很快就能吸收，很不错,2021-04-05 09:13:06,Null,Null,Null,True,1128218475709,False,眼霜,化妆品净含量:宝石蓝管,ahc眼霜抗皱细纹去淡化黑眼圈补水保湿学生女第八代8七男眼袋去除,tmall,https://detail.tmall.com/item.htm?id=567637757708&ns=1&abbucket=6
1015,1***l,不错，刚刚实涂了一下手背，很快就吸收的，不会能黏的，我怕很黏的，但是没有，很喜欢，喜欢可以能淡化我的细纹哈哈哈,2021-04-13 18:02:36,Null,Null,Null,True,1129324363031,False,眼霜,化妆品净含量:炫黑黑管,ahc眼霜抗皱细纹去淡化黑眼圈补水保湿学生女第八代8七男眼袋去除,tmall,https://detail.tmall.com/item.htm?id=567637757708&ns=1&abbucket=6
1016,t***2,眼霜、面膜和防晒霜是一起买的😁😁😁都是最近必需的，趁着过年不打烊入的，都很不错👍👍个人感觉蛮好用的，眼霜质地柔软，轻薄好涂抹，按摩一下吸收的很快，面膜精华液含量足，敷完皮肤水润十足💧💧💧防晒霜高倍防晒，防水也防汗的哦，挺满意的🎉🎉,2021-02-17 18:44:01,面膜是10片一盒的，买的是4盒装，耐用⭕⭕⭕眼霜选的是ahc，平价又好用👍👍防晒霜入的mistine，涂抹一下，成膜速度快，买它ⓂⓂⓂ,2021-02-17 18:45:45,0,True,1122904934094,False,眼霜,化妆品净含量:宝石蓝管,ahc眼霜抗皱细纹去淡化黑眼圈补水保湿学生女第八代8七男眼袋去除,tmall,https://detail.tmall.com/item.htm?id=567637757708&ns=1&abbucket=6
1017,t***4,以前就用过的眼霜，感觉还是一样的好用，我更喜欢这个新包装,2021-03-28 09:20:11,Null,Null,Null,True,1126354073973,False,眼霜,化妆品净含量:宝石蓝管,ahc眼霜抗皱细纹去淡化黑眼圈补水保湿学生女第八代8七男眼袋去除,tmall,https://detail.tmall.com/item.htm?id=567637757708&ns=1&abbucket=6
1018,t***9,包装完美，保湿效果不错，这是第6次购买了,2021-04-10 13:13:40,Null,Null,Null,True,1128894267481,False,眼霜,化妆品净含量:宝石蓝管,ahc眼霜抗皱细纹去淡化黑眼圈补水保湿学生女第八代8七男眼袋去除,tmall,https://detail.tmall.com/item.htm?id=567637757708&ns=1&abbucket=6
1019,北***6,正品。宝和外面海淘买的是一样的。正品，好用,2021-04-06 19:01:45,Null,Null,Null,True,1128437339259,False,眼霜,化妆品净含量:魅影紫管,ahc眼霜抗皱细纹去淡化黑眼圈补水保湿学生女第八代8七男眼袋去除,tmall,https://detail.tmall.com/item.htm?id=567637757708&ns=1&abbucket=6
1020,t***9,包装品质：包装完整 商品气味：味道好闻 使用效果：效果很好,2021-04-07 16:53:00,Null,Null,Null,True,1127716845008,False,眼霜,化妆品净含量:魅影紫管,ahc眼霜抗皱细纹去淡化黑眼圈补水保湿学生女第八代8七男眼袋去除,tmall,https://detail.tmall.com/item.htm?id=567637757708&ns=1&abbucket=6
1021,h***7,眼霜，选这款ahc蓝宝石的，很不错👍👍质地特水润，轻薄好涂抹，用后眼周很舒爽😎😎😎清清凉凉的，真的是很舒服的哇，性价比蛮高的，用了就感觉黑眼圈都变淡了😂😂😂,2021-02-22 14:50:47,买的很划算，也很好用，非常的满意✌✌,2021-02-22 14:52:03,0,True,1123631591598,False,眼霜,化妆品净含量:宝石蓝管,ahc眼霜抗皱细纹去淡化黑眼圈补水保湿学生女第八代8七男眼袋去除,tmall,https://detail.tmall.com/item.htm?id=567637757708&ns=1&abbucket=6
1022,t***1,很好用，不油腻,2021-03-28 10:23:53,Null,Null,Null,True,1126362937278,False,眼霜,化妆品净含量:魅影紫管,ahc眼霜抗皱细纹去淡化黑眼圈补水保湿学生女第八代8七男眼袋去除,tmall,https://detail.tmall.com/item.htm?id=567637757708&ns=1&abbucket=6
1023,一***3,宝贝收到了，颜色很漂亮，有一种高大上的感觉，喜欢的姐妹们赶紧下手吧！,2021-04-13 17:19:56,Null,Null,Null,True,1129318419126,False,眼霜,化妆品净含量:魅影紫管,ahc眼霜抗皱细纹去淡化黑眼圈补水保湿学生女第八代8七男眼袋去除,tmall,https://detail.tmall.com/item.htm?id=567637757708&ns=1&abbucket=6
1024,勤***g,他家的产品真的好用☕，水杨酸用了一段时间控油去黑头效果真的很棒💝，用起来很清爽不刺激，眼膜和眼霜用起来很温和的🍔，现在眼部肌肤变得很滋润，黑眼圈也变[爱心]淡了。,2021-02-22 09:59:19,店家送的面膜超级补水呢，五星好评。,2021-02-22 10:12:37,0,True,1122812357257,False,眼霜,化妆品净含量:炫黑黑管,ahc眼霜抗皱细纹去淡化黑眼圈补水保湿学生女第八代8七男眼袋去除,tmall,https://detail.tmall.com/item.htm?id=567637757708&ns=1&abbucket=6
1025,t***0,包装挺好的，还有封口挺用心的，这个价格的眼霜真的不贵，还没有使用，我觉得挺好的,2021-04-14 20:52:40,Null,Null,Null,True,1128192764407,False,眼霜,化妆品净含量:炫黑黑管,ahc眼霜抗皱细纹去淡化黑眼圈补水保湿学生女第八代8七男眼袋去除,tmall,https://detail.tmall.com/item.htm?id=567637757708&ns=1&abbucket=6
1026,s***s,坚持用眼霜，对眼周肌肤的改善真的是很棒的哇👍👍👍质地水润，轻薄好涂抹的呢😎😎😎用后眼周很放松，淡化黑眼圈效果很赞，个人使用感很好，非常的喜欢😍😍,2021-02-09 20:05:09,实惠又好用，性价比挺高的，可以放心入😁😁😁,2021-02-09 20:05:31,0,True,1121510224573,False,眼霜,化妆品净含量:魅影紫管,ahc眼霜抗皱细纹去淡化黑眼圈补水保湿学生女第八代8七男眼袋去除,tmall,https://detail.tmall.com/item.htm?id=567637757708&ns=1&abbucket=6
