index,用户昵称,初评,初评日期,追评,追评日期,追评天数,是否有用,用户id,超级会员,产品,类别,标题,平台,商品链接
435,赵***0,到货，我就迫不及待的用了一下，刺抛很好用，面膜没有想象中的提拉紧绷感，用着一般,2020-11-16 07:22:59,次抛非常好用,2020-11-16 22:35:05,1,True,1111124130989,False,面膜,化妆品净含量:5片,润百颜润养奶皮面膜377精粹提亮肤色玻尿酸补水弹嫩保湿牛奶肌女,tmall,https://detail.tmall.com/item.htm?id=622935172595&ns=1&abbucket=6
436,c***梦,用了一片，无功无过，但是面膜纸真的很舒服，特别丝滑，而且很大，特地特地留了一块敷脖子很棒,2020-11-19 22:18:20,Null,Null,Null,True,1111736626471,False,面膜,化妆品净含量:5片,润百颜润养奶皮面膜377精粹提亮肤色玻尿酸补水弹嫩保湿牛奶肌女,tmall,https://detail.tmall.com/item.htm?id=622935172595&ns=1&abbucket=6
437,t***e,试一下377，希望能美白。看重它提拉的效果。只有活动买较为划算。,2020-11-20 21:47:55,Null,Null,Null,True,1111502057208,True,面膜,化妆品净含量:5片,润百颜润养奶皮面膜377精粹提亮肤色玻尿酸补水弹嫩保湿牛奶肌女,tmall,https://detail.tmall.com/item.htm?id=622935172595&ns=1&abbucket=6
438,白***1,还没用，是看viya直播买的。先用着，还送了几支次抛原液,2020-11-16 14:36:40,Null,Null,Null,True,1111199138224,True,面膜,化妆品净含量:5片,润百颜润养奶皮面膜377精粹提亮肤色玻尿酸补水弹嫩保湿牛奶肌女,tmall,https://detail.tmall.com/item.htm?id=622935172595&ns=1&abbucket=6
439,岸***星,他们家的次抛很好用，直播间看见面膜果断囤货，都可以包裹下巴，挺好的,2020-11-22 00:59:08,Null,Null,Null,True,1112386935484,True,面膜,化妆品净含量:5片,润百颜润养奶皮面膜377精粹提亮肤色玻尿酸补水弹嫩保湿牛奶肌女,tmall,https://detail.tmall.com/item.htm?id=622935172595&ns=1&abbucket=6
440,雨***贝,薇娅直播间抢的，抢的太快没有看清楚买两盒。客服耐心听完解释答应先收货再给我补发。那我就本着信任先确定收货啦！希望可以早点收到货品。这个小失误还是我自己造成的，客服还是很不错的,2020-11-18 23:23:06,Null,Null,Null,True,1111947211819,False,面膜,化妆品净含量:5片,润百颜润养奶皮面膜377精粹提亮肤色玻尿酸补水弹嫩保湿牛奶肌女,tmall,https://detail.tmall.com/item.htm?id=622935172595&ns=1&abbucket=6
441,徐***z,昨晚收到的，马上就用了一贴，还不错，坚持用三天看看,2020-11-18 22:37:32,Null,Null,Null,True,1111588590600,False,面膜,化妆品净含量:5片,润百颜润养奶皮面膜377精粹提亮肤色玻尿酸补水弹嫩保湿牛奶肌女,tmall,https://detail.tmall.com/item.htm?id=622935172595&ns=1&abbucket=6
442,李***9,送的面膜很好用，会回购，精华比较清爽，效果期待中,2020-11-19 21:34:07,Null,Null,Null,True,1112085327452,True,面膜,化妆品净含量:5片,润百颜润养奶皮面膜377精粹提亮肤色玻尿酸补水弹嫩保湿牛奶肌女,tmall,https://detail.tmall.com/item.htm?id=622935172595&ns=1&abbucket=6
443,r***8,直播间买一盒送一盒还有几支次抛，很划算，次抛一直在用，华熙生物的东西不错。,2020-11-17 08:25:41,Null,Null,Null,True,1111653807527,True,面膜,化妆品净含量:5片,润百颜润养奶皮面膜377精粹提亮肤色玻尿酸补水弹嫩保湿牛奶肌女,tmall,https://detail.tmall.com/item.htm?id=622935172595&ns=1&abbucket=6
444,期***s,直播间买的，简直太划算了，看评价说是不错，不过所有的产品都是甲之蜜糖，乙之砒霜，好不好用只有自己试过才知道,2020-11-16 11:56:05,Null,Null,Null,True,1110793197082,True,面膜,化妆品净含量:5片,润百颜润养奶皮面膜377精粹提亮肤色玻尿酸补水弹嫩保湿牛奶肌女,tmall,https://detail.tmall.com/item.htm?id=622935172595&ns=1&abbucket=6
445,x***7,薇娅推荐买点试一下，还行,2020-11-21 11:16:33,Null,Null,Null,True,1111928830395,True,面膜,化妆品净含量:5片,润百颜润养奶皮面膜377精粹提亮肤色玻尿酸补水弹嫩保湿牛奶肌女,tmall,https://detail.tmall.com/item.htm?id=622935172595&ns=1&abbucket=6
446,l***6,没用。看着主播的讲解，又有优惠，果断下手囤货了。,2020-11-17 15:34:56,Null,Null,Null,True,1111373494555,True,面膜,化妆品净含量:5片,润百颜润养奶皮面膜377精粹提亮肤色玻尿酸补水弹嫩保湿牛奶肌女,tmall,https://detail.tmall.com/item.htm?id=622935172595&ns=1&abbucket=6
447,上***2,特别好用。我先用次抛打底，然后敷面膜，敷完后皮肤很细腻，我妈说皮肤看着都亮了。很好用的，下次接着囤。希望次抛和面膜多做活动，大家都试试看。,2020-11-20 10:57:01,Null,Null,Null,True,1111028656656,False,面膜,化妆品净含量:5片,润百颜润养奶皮面膜377精粹提亮肤色玻尿酸补水弹嫩保湿牛奶肌女,tmall,https://detail.tmall.com/item.htm?id=622935172595&ns=1&abbucket=6
448,吴***妈,没有收到赠品，双十一看有赠品活动下单买了，结果收到货没有赠品，也没有想象的美白补水，请慎买，不是贵就好用,2020-11-17 10:15:53,Null,Null,Null,True,1110572048148,False,面膜,化妆品净含量:5片,润百颜润养奶皮面膜377精粹提亮肤色玻尿酸补水弹嫩保湿牛奶肌女,tmall,https://detail.tmall.com/item.htm?id=622935172595&ns=1&abbucket=6
449,s***7,薇雅直播间买的，算是实惠吧，帮朋友买的。她一直用润百颜的精华,2020-11-18 03:15:31,Null,Null,Null,True,1111450618798,False,面膜,化妆品净含量:5片,润百颜润养奶皮面膜377精粹提亮肤色玻尿酸补水弹嫩保湿牛奶肌女,tmall,https://detail.tmall.com/item.htm?id=622935172595&ns=1&abbucket=6
450,小***m,很好，值得推荐噢，朋友很喜欢。,2020-11-17 10:43:01,Null,Null,Null,True,1110576776261,True,面膜,化妆品净含量:5片,润百颜润养奶皮面膜377精粹提亮肤色玻尿酸补水弹嫩保湿牛奶肌女,tmall,https://detail.tmall.com/item.htm?id=622935172595&ns=1&abbucket=6
451,z***6,第一次买，晚上回去试试好不好用,2020-11-16 14:38:34,Null,Null,Null,True,1110823713532,True,面膜,化妆品净含量:5片,润百颜润养奶皮面膜377精粹提亮肤色玻尿酸补水弹嫩保湿牛奶肌女,tmall,https://detail.tmall.com/item.htm?id=622935172595&ns=1&abbucket=6
452,m***0,保湿必备单品、不刺激皮肤，效果好,2020-11-20 14:42:18,Null,Null,Null,True,1111817302828,False,面膜,化妆品净含量:5片,润百颜润养奶皮面膜377精粹提亮肤色玻尿酸补水弹嫩保湿牛奶肌女,tmall,https://detail.tmall.com/item.htm?id=622935172595&ns=1&abbucket=6
453,我***月,打算今晚用试试，非常期待(๑˙ー˙๑),2020-11-18 09:39:59,Null,Null,Null,True,1111823083692,False,面膜,化妆品净含量:5片,润百颜润养奶皮面膜377精粹提亮肤色玻尿酸补水弹嫩保湿牛奶肌女,tmall,https://detail.tmall.com/item.htm?id=622935172595&ns=1&abbucket=6
454,想***天,挺好用的，清爽不黏腻，面膜纸真的很舒服,2020-11-21 21:11:01,Null,Null,Null,True,1112368487755,True,面膜,化妆品净含量:5片,润百颜润养奶皮面膜377精粹提亮肤色玻尿酸补水弹嫩保湿牛奶肌女,tmall,https://detail.tmall.com/item.htm?id=622935172595&ns=1&abbucket=6
455,n***j,滋润不油腻，面膜够大！,2020-11-18 08:01:19,Null,Null,Null,True,1111079813905,False,面膜,化妆品净含量:5片,润百颜润养奶皮面膜377精粹提亮肤色玻尿酸补水弹嫩保湿牛奶肌女,tmall,https://detail.tmall.com/item.htm?id=622935172595&ns=1&abbucket=6
456,清***舞,生活，一半烟火，一半清欢。幸福，一半争取，一半随缘。人生，一半清醒一半释然，当流年盛世终成过往。最是喜欢那种千帆过后，蓦然回首，一笑置之的淡然！,2020-11-17 15:28:19,Null,Null,Null,True,1111372754546,False,面膜,化妆品净含量:5片,润百颜润养奶皮面膜377精粹提亮肤色玻尿酸补水弹嫩保湿牛奶肌女,tmall,https://detail.tmall.com/item.htm?id=622935172595&ns=1&abbucket=6
457,寻***致,买一送一，还有6支原液，好用又便宜，物流又快又好,2020-11-16 21:39:15,Null,Null,Null,True,1111624659096,False,面膜,化妆品净含量:5片,润百颜润养奶皮面膜377精粹提亮肤色玻尿酸补水弹嫩保湿牛奶肌女,tmall,https://detail.tmall.com/item.htm?id=622935172595&ns=1&abbucket=6
458,妞***7,还没用，用完我回来追评达,2020-11-16 15:22:27,Null,Null,Null,True,1110832117622,True,面膜,化妆品净含量:5片,润百颜润养奶皮面膜377精粹提亮肤色玻尿酸补水弹嫩保湿牛奶肌女,tmall,https://detail.tmall.com/item.htm?id=622935172595&ns=1&abbucket=6
459,s***a,第二次回购，薇娅直播间比店铺双十一都要优惠很多啊，138买一送一，还送五个次抛原液。,2020-11-17 17:16:33,Null,Null,Null,True,1111392230281,True,面膜,化妆品净含量:5片,润百颜润养奶皮面膜377精粹提亮肤色玻尿酸补水弹嫩保湿牛奶肌女,tmall,https://detail.tmall.com/item.htm?id=622935172595&ns=1&abbucket=6
460,开***1,第一次买，希望效果好～,2020-11-21 23:00:38,Null,Null,Null,True,1111645885957,False,面膜,化妆品净含量:5片,润百颜润养奶皮面膜377精粹提亮肤色玻尿酸补水弹嫩保湿牛奶肌女,tmall,https://detail.tmall.com/item.htm?id=622935172595&ns=1&abbucket=6
461,y***苒,很喜欢这个面膜的材质，目前只用了一次，比较滋润，裁剪挺贴合皮肤！,2020-11-18 11:04:39,Null,Null,Null,True,1111482946500,True,面膜,化妆品净含量:5片,润百颜润养奶皮面膜377精粹提亮肤色玻尿酸补水弹嫩保湿牛奶肌女,tmall,https://detail.tmall.com/item.htm?id=622935172595&ns=1&abbucket=6
462,魏***然,价格合适的就凑单买了 不过用起来感觉没有另外那个玻尿酸的好 整体好评,2020-11-16 20:22:02,Null,Null,Null,True,1111612387764,False,面膜,化妆品净含量:5片,润百颜润养奶皮面膜377精粹提亮肤色玻尿酸补水弹嫩保湿牛奶肌女,tmall,https://detail.tmall.com/item.htm?id=622935172595&ns=1&abbucket=6
463,娃***6,目前用了两片觉得还不错，薇娅双十一买的，比较划算,2020-11-20 16:48:34,Null,Null,Null,True,1111840186436,True,面膜,化妆品净含量:5片,润百颜润养奶皮面膜377精粹提亮肤色玻尿酸补水弹嫩保湿牛奶肌女,tmall,https://detail.tmall.com/item.htm?id=622935172595&ns=1&abbucket=6
464,h***5,薇娅推荐还没用,2020-11-19 20:52:39,Null,Null,Null,True,1111347101861,False,面膜,化妆品净含量:5片,润百颜润养奶皮面膜377精粹提亮肤色玻尿酸补水弹嫩保湿牛奶肌女,tmall,https://detail.tmall.com/item.htm?id=622935172595&ns=1&abbucket=6
465,飞***翼,还没用。先给好评,2020-11-16 21:50:52,Null,Null,Null,True,1110898077701,True,面膜,化妆品净含量:5片,润百颜润养奶皮面膜377精粹提亮肤色玻尿酸补水弹嫩保湿牛奶肌女,tmall,https://detail.tmall.com/item.htm?id=622935172595&ns=1&abbucket=6
466,t***2,很好用，一般都是在直播间抢才優惠多。,2020-11-18 10:00:12,Null,Null,Null,True,1111095329584,True,面膜,化妆品净含量:5片,润百颜润养奶皮面膜377精粹提亮肤色玻尿酸补水弹嫩保湿牛奶肌女,tmall,https://detail.tmall.com/item.htm?id=622935172595&ns=1&abbucket=6
467,初***毓,第二次购买了，使用感很不错，面膜服帖，每次用完都觉得皮肤状态很好，持续回购的面膜，多会有活动多囤点,2020-11-18 20:01:46,Null,Null,Null,True,1111192805178,True,面膜,化妆品净含量:5片,润百颜润养奶皮面膜377精粹提亮肤色玻尿酸补水弹嫩保湿牛奶肌女,tmall,https://detail.tmall.com/item.htm?id=622935172595&ns=1&abbucket=6
468,s***2,贴纸很舒服，货刚到只用了一次。赠品很多，双十一很划算。感觉比韩国货，泰国货，日本货强,2020-11-17 00:41:48,Null,Null,Null,True,1110542628049,False,面膜,化妆品净含量:5片,润百颜润养奶皮面膜377精粹提亮肤色玻尿酸补水弹嫩保湿牛奶肌女,tmall,https://detail.tmall.com/item.htm?id=622935172595&ns=1&abbucket=6
469,想***吗,在薇娅直播间买的，又实惠又好用，爱了,2020-11-21 11:50:31,Null,Null,Null,True,1111933682562,True,面膜,化妆品净含量:5片,润百颜润养奶皮面膜377精粹提亮肤色玻尿酸补水弹嫩保湿牛奶肌女,tmall,https://detail.tmall.com/item.htm?id=622935172595&ns=1&abbucket=6
470,荒***1,巨好用无比，脸嫩*了。薇娅有毒，掏空我钱包还让我开心,2020-11-17 10:40:48,Null,Null,Null,True,1111324358435,False,面膜,化妆品净含量:5片,润百颜润养奶皮面膜377精粹提亮肤色玻尿酸补水弹嫩保湿牛奶肌女,tmall,https://detail.tmall.com/item.htm?id=622935172595&ns=1&abbucket=6
471,c***雅,第二次买了，太不错了，双十一挺优惠的，赠品也好用,2020-11-18 09:25:40,Null,Null,Null,True,1111090653256,True,面膜,化妆品净含量:5片,润百颜润养奶皮面膜377精粹提亮肤色玻尿酸补水弹嫩保湿牛奶肌女,tmall,https://detail.tmall.com/item.htm?id=622935172595&ns=1&abbucket=6
472,大***3,真的很像奶皮，用完皮肤软软的,2020-11-18 13:38:02,Null,Null,Null,True,1111507542525,True,面膜,化妆品净含量:5片,润百颜润养奶皮面膜377精粹提亮肤色玻尿酸补水弹嫩保湿牛奶肌女,tmall,https://detail.tmall.com/item.htm?id=622935172595&ns=1&abbucket=6
473,l***1,润百颜一直不错,2020-11-16 19:34:15,Null,Null,Null,True,1111253070517,True,面膜,化妆品净含量:5片,润百颜润养奶皮面膜377精粹提亮肤色玻尿酸补水弹嫩保湿牛奶肌女,tmall,https://detail.tmall.com/item.htm?id=622935172595&ns=1&abbucket=6
474,m***5,精华液的量不会滴下来，面膜纸丰厚有弹性，是开叉设计，功效贴了一次还看不出来,2020-11-17 08:12:21,Null,Null,Null,True,1111652031813,True,面膜,化妆品净含量:5片,润百颜润养奶皮面膜377精粹提亮肤色玻尿酸补水弹嫩保湿牛奶肌女,tmall,https://detail.tmall.com/item.htm?id=622935172595&ns=1&abbucket=6
475,张***a,还买了夸迪美白精华～希望好用～～,2020-11-17 11:29:08,Null,Null,Null,True,1111332974324,True,面膜,化妆品净含量:5片,润百颜润养奶皮面膜377精粹提亮肤色玻尿酸补水弹嫩保湿牛奶肌女,tmall,https://detail.tmall.com/item.htm?id=622935172595&ns=1&abbucket=6
476,k***3,补水效果不错，就是面膜的鼻翼部小了，我的鼻子不大了，也拢不住，有点尴尬，其他都还行,2021-02-01 21:48:30,Null,Null,Null,True,1121107081705,True,面膜,化妆品净含量:5片,润百颜润养奶皮面膜377精粹提亮肤色玻尿酸补水弹嫩保湿牛奶肌女,tmall,https://detail.tmall.com/item.htm?id=622935172595&ns=1&abbucket=6
477,黎***y,此用户没有填写评论!,2020-12-12 22:59:56,最不适合我的一款面膜形状了，没有之一，额头脸颊两侧特别小，下巴超级超级超级长，感觉就是也对我这种大脸短下巴的一种侮辱&hellip;&hellip;,2021-02-11 12:59:55,75,True,1122834263610,True,面膜,化妆品净含量:5片,润百颜润养奶皮面膜377精粹提亮肤色玻尿酸补水弹嫩保湿牛奶肌女,tmall,https://detail.tmall.com/item.htm?id=622935172595&ns=1&abbucket=6
478,c***n,双十一很划算 还没有用 用完再来追加,2020-11-18 07:07:48,Null,Null,Null,True,1110705256214,True,面膜,化妆品净含量:5片,润百颜润养奶皮面膜377精粹提亮肤色玻尿酸补水弹嫩保湿牛奶肌女,tmall,https://detail.tmall.com/item.htm?id=622935172595&ns=1&abbucket=6
479,s***7,没有香味，额头部分有点小了，用起来很舒服。我是修复晒伤的，很有用。,2020-11-19 07:21:25,Null,Null,Null,True,1110855836253,True,面膜,化妆品净含量:5片,润百颜润养奶皮面膜377精粹提亮肤色玻尿酸补水弹嫩保湿牛奶肌女,tmall,https://detail.tmall.com/item.htm?id=622935172595&ns=1&abbucket=6
480,徐***瑞,奶皮面膜，薇娅直播间买的，试试看效果，效果好来追评,2020-11-16 18:37:45,Null,Null,Null,True,1110868125965,False,面膜,化妆品净含量:5片,润百颜润养奶皮面膜377精粹提亮肤色玻尿酸补水弹嫩保湿牛奶肌女,tmall,https://detail.tmall.com/item.htm?id=622935172595&ns=1&abbucket=6
481,m***y,薇娅直播间买的，买面膜送次抛，润百颜的东西都特别喜欢，趁着双十一性价比高各种囤,2020-11-18 14:18:48,Null,Null,Null,True,1110766272234,True,面膜,化妆品净含量:5片,润百颜润养奶皮面膜377精粹提亮肤色玻尿酸补水弹嫩保湿牛奶肌女,tmall,https://detail.tmall.com/item.htm?id=622935172595&ns=1&abbucket=6
482,y***n,直播间购买，质量超级棒，性价比超高，必须给好评！,2020-11-21 11:02:21,Null,Null,Null,True,1112280383632,True,面膜,化妆品净含量:5片,润百颜润养奶皮面膜377精粹提亮肤色玻尿酸补水弹嫩保湿牛奶肌女,tmall,https://detail.tmall.com/item.htm?id=622935172595&ns=1&abbucket=6
483,o***0,这么不错呦，下次再有直播还继续。没有优惠的价格太贵了，直播价格真的美丽。,2020-11-16 11:22:49,Null,Null,Null,True,1110414852665,True,面膜,化妆品净含量:5片,润百颜润养奶皮面膜377精粹提亮肤色玻尿酸补水弹嫩保湿牛奶肌女,tmall,https://detail.tmall.com/item.htm?id=622935172595&ns=1&abbucket=6
484,w***0,第一次用奶皮面膜，很好用啊，面膜纸够宽大非常贴服！,2020-11-19 15:13:23,Null,Null,Null,True,1110922728306,True,面膜,化妆品净含量:5片,润百颜润养奶皮面膜377精粹提亮肤色玻尿酸补水弹嫩保湿牛奶肌女,tmall,https://detail.tmall.com/item.htm?id=622935172595&ns=1&abbucket=6
485,q***4,买了太多面膜，还没用，等用了看效果再来评价，直播间买的觉得挺合算的,2020-11-17 19:00:32,Null,Null,Null,True,1111031693455,True,面膜,化妆品净含量:5片,润百颜润养奶皮面膜377精粹提亮肤色玻尿酸补水弹嫩保湿牛奶肌女,tmall,https://detail.tmall.com/item.htm?id=622935172595&ns=1&abbucket=6
486,t***3,用了很多面膜，这个整体效果挺好，皮肤很滋润,2020-11-21 22:19:29,Null,Null,Null,True,1112375631918,False,面膜,化妆品净含量:5片,润百颜润养奶皮面膜377精粹提亮肤色玻尿酸补水弹嫩保湿牛奶肌女,tmall,https://detail.tmall.com/item.htm?id=622935172595&ns=1&abbucket=6
487,s***1,大品牌！值得信赖的！效果超级好！贵有贵的道理！很棒的商品！,2020-11-21 17:07:28,Null,Null,Null,True,1112336871040,True,面膜,化妆品净含量:5片,润百颜润养奶皮面膜377精粹提亮肤色玻尿酸补水弹嫩保湿牛奶肌女,tmall,https://detail.tmall.com/item.htm?id=622935172595&ns=1&abbucket=6
488,记***7,还不错哦滑滑的,2020-11-18 18:18:25,Null,Null,Null,True,1111178529269,True,面膜,化妆品净含量:5片,润百颜润养奶皮面膜377精粹提亮肤色玻尿酸补水弹嫩保湿牛奶肌女,tmall,https://detail.tmall.com/item.htm?id=622935172595&ns=1&abbucket=6
489,l***涵,保湿效果不错，刚用，其它效果还没有感觉到,2020-11-17 22:25:22,Null,Null,Null,True,1111061013065,True,面膜,化妆品净含量:5片,润百颜润养奶皮面膜377精粹提亮肤色玻尿酸补水弹嫩保湿牛奶肌女,tmall,https://detail.tmall.com/item.htm?id=622935172595&ns=1&abbucket=6
490,棱***0,面膜质地很好，像奶皮一样滑，双11价格也很美丽，囤了两盒,2020-11-16 10:36:38,Null,Null,Null,True,1111153170803,True,面膜,化妆品净含量:5片,润百颜润养奶皮面膜377精粹提亮肤色玻尿酸补水弹嫩保湿牛奶肌女,tmall,https://detail.tmall.com/item.htm?id=622935172595&ns=1&abbucket=6
491,玉***鹏,已经用了两贴，非常好用，服帖，我感觉美白效果很好，非常满意,2020-11-20 09:04:07,Null,Null,Null,True,1111011880960,False,面膜,化妆品净含量:5片,润百颜润养奶皮面膜377精粹提亮肤色玻尿酸补水弹嫩保湿牛奶肌女,tmall,https://detail.tmall.com/item.htm?id=622935172595&ns=1&abbucket=6
492,爱***0,很不错！很好用！很喜欢💕,2020-11-16 18:43:31,Null,Null,Null,True,1111244630626,True,面膜,化妆品净含量:5片,润百颜润养奶皮面膜377精粹提亮肤色玻尿酸补水弹嫩保湿牛奶肌女,tmall,https://detail.tmall.com/item.htm?id=622935172595&ns=1&abbucket=6
493,w***5,很多美容院都在推的润百颜，小贵，赶上双十一活动很划算。,2020-11-20 21:33:12,Null,Null,Null,True,1111126568231,False,面膜,化妆品净含量:5片,润百颜润养奶皮面膜377精粹提亮肤色玻尿酸补水弹嫩保湿牛奶肌女,tmall,https://detail.tmall.com/item.htm?id=622935172595&ns=1&abbucket=6
494,9***y,好用，下次有优惠还会买。,2020-11-16 20:35:24,Null,Null,Null,True,1110515004336,False,面膜,化妆品净含量:5片,润百颜润养奶皮面膜377精粹提亮肤色玻尿酸补水弹嫩保湿牛奶肌女,tmall,https://detail.tmall.com/item.htm?id=622935172595&ns=1&abbucket=6
495,t***7,还没有用，双十一真是划算,2020-11-17 09:19:34,Null,Null,Null,True,1111309258963,True,面膜,化妆品净含量:5片,润百颜润养奶皮面膜377精粹提亮肤色玻尿酸补水弹嫩保湿牛奶肌女,tmall,https://detail.tmall.com/item.htm?id=622935172595&ns=1&abbucket=6
496,e***璞,用过润百颜的日抛很好用   提拉紧致的面膜也很好用  这次活动  立即下手,2020-11-21 20:27:15,Null,Null,Null,True,1112009638796,False,面膜,化妆品净含量:5片,润百颜润养奶皮面膜377精粹提亮肤色玻尿酸补水弹嫩保湿牛奶肌女,tmall,https://detail.tmall.com/item.htm?id=622935172595&ns=1&abbucket=6
497,a***m,感觉还行，直播买的，比较划算,2020-11-17 22:08:06,Null,Null,Null,True,1111435218670,True,面膜,化妆品净含量:5片,润百颜润养奶皮面膜377精粹提亮肤色玻尿酸补水弹嫩保湿牛奶肌女,tmall,https://detail.tmall.com/item.htm?id=622935172595&ns=1&abbucket=6
498,奈***哆,面膜很好用 敷完之后脸很滑 送的玻尿酸感觉一般般 油皮觉得有点粘,2020-11-16 08:24:46,Null,Null,Null,True,1110754785099,True,面膜,化妆品净含量:5片,润百颜润养奶皮面膜377精粹提亮肤色玻尿酸补水弹嫩保湿牛奶肌女,tmall,https://detail.tmall.com/item.htm?id=622935172595&ns=1&abbucket=6
499,b***a,很特别的面膜质地 上脸很舒服 精华液也丰富,2020-11-19 10:03:37,Null,Null,Null,True,1110873548395,True,面膜,化妆品净含量:5片,润百颜润养奶皮面膜377精粹提亮肤色玻尿酸补水弹嫩保湿牛奶肌女,tmall,https://detail.tmall.com/item.htm?id=622935172595&ns=1&abbucket=6
500,z***8,好用实惠,2020-11-17 19:23:12,Null,Null,Null,True,1110663000320,False,面膜,化妆品净含量:5片,润百颜润养奶皮面膜377精粹提亮肤色玻尿酸补水弹嫩保湿牛奶肌女,tmall,https://detail.tmall.com/item.htm?id=622935172595&ns=1&abbucket=6
501,a***3,挺好，实惠,2020-11-18 09:37:42,Null,Null,Null,True,1111092189845,True,面膜,化妆品净含量:5片,润百颜润养奶皮面膜377精粹提亮肤色玻尿酸补水弹嫩保湿牛奶肌女,tmall,https://detail.tmall.com/item.htm?id=622935172595&ns=1&abbucket=6
502,咪***天,朋友推荐的牌子，说是挺好的，刚收到货，后续用一下再追评。,2020-11-16 09:45:19,Null,Null,Null,True,1111495675702,False,面膜,化妆品净含量:5片,润百颜润养奶皮面膜377精粹提亮肤色玻尿酸补水弹嫩保湿牛奶肌女,tmall,https://detail.tmall.com/item.htm?id=622935172595&ns=1&abbucket=6
503,t***2,推荐的时候说敏感皮肤也可以用，就买了，结果还是过敏了，欲哭无泪！,2020-11-17 21:57:23,Null,Null,Null,True,1111056945726,False,面膜,化妆品净含量:5片,润百颜润养奶皮面膜377精粹提亮肤色玻尿酸补水弹嫩保湿牛奶肌女,tmall,https://detail.tmall.com/item.htm?id=622935172595&ns=1&abbucket=6
504,金***3,薇娅直播间购买，还没用过，活动力度还可以。用后再来评价。,2020-11-16 20:06:30,Null,Null,Null,True,1110882405549,False,面膜,化妆品净含量:5片,润百颜润养奶皮面膜377精粹提亮肤色玻尿酸补水弹嫩保湿牛奶肌女,tmall,https://detail.tmall.com/item.htm?id=622935172595&ns=1&abbucket=6
505,歪***薇,我是干性肤质，收到后用了一片，第二天早上起来皮肤有变亮一点,2020-11-19 12:24:31,Null,Null,Null,True,1111644806463,True,面膜,化妆品净含量:5片,润百颜润养奶皮面膜377精粹提亮肤色玻尿酸补水弹嫩保湿牛奶肌女,tmall,https://detail.tmall.com/item.htm?id=622935172595&ns=1&abbucket=6
506,c***0,二次回购，喜欢奶皮的面膜纸，厚厚的，上脸很服帖。,2020-11-20 22:22:05,Null,Null,Null,True,1111131928243,True,面膜,化妆品净含量:5片,润百颜润养奶皮面膜377精粹提亮肤色玻尿酸补水弹嫩保湿牛奶肌女,tmall,https://detail.tmall.com/item.htm?id=622935172595&ns=1&abbucket=6
507,小***7,试用了一下，丝丝滑滑的，很舒服，补水也还行,2020-11-20 07:53:20,Null,Null,Null,True,1112110063348,False,面膜,化妆品净含量:5片,润百颜润养奶皮面膜377精粹提亮肤色玻尿酸补水弹嫩保湿牛奶肌女,tmall,https://detail.tmall.com/item.htm?id=622935172595&ns=1&abbucket=6
508,孤***2,还没用面膜，期待效果，一直用润百颜玻尿酸，好评,2020-11-16 17:43:48,Null,Null,Null,True,1110858421926,True,面膜,化妆品净含量:5片,润百颜润养奶皮面膜377精粹提亮肤色玻尿酸补水弹嫩保湿牛奶肌女,tmall,https://detail.tmall.com/item.htm?id=622935172595&ns=1&abbucket=6
